source,title,body,url,score,num_comments,timestamp
reddit,Larry Ellison discussed axing CNN hosts with White House in takeover bid talks,,https://reddit.com/r/news/comments/1p27u2f/larry_ellison_discussed_axing_cnn_hosts_with/,8303,303,1763656549.0
reddit,44 year old mom sentenced to 26 years for felony sex crimes involving teenagers aged 14 to 16 years old.,,https://reddit.com/r/news/comments/1p240uh/44_year_old_mom_sentenced_to_26_years_for_felony/,13485,1219,1763647550.0
reddit,"2 children, 2 men die in Tiffin murder-suicide, mom ‘visibly traumatized’",,https://reddit.com/r/news/comments/1p2b8yt/2_children_2_men_die_in_tiffin_murdersuicide_mom/,3634,463,1763664095.0
reddit,Georgia man sentenced for attempting to sell teen on the dark web,,https://reddit.com/r/news/comments/1p29r82/georgia_man_sentenced_for_attempting_to_sell_teen/,4220,323,1763660883.0
reddit,"Falls, feuds and fury: Miss Universe crowned after chaotic – and controversial – pageant",,https://reddit.com/r/news/comments/1p2tx42/falls_feuds_and_fury_miss_universe_crowned_after/,217,65,1763716062.0
reddit,"Soup kitchen facing eviction after church doubles rent costs, cuts hours",,https://reddit.com/r/news/comments/1p24ax7/soup_kitchen_facing_eviction_after_church_doubles/,6092,480,1763648253.0
reddit,Sources: Border Patrol operation in Charlotte ends,,https://reddit.com/r/news/comments/1p262r8/sources_border_patrol_operation_in_charlotte_ends/,4608,262,1763652566.0
reddit,2nd grade teacher arrested after video of 22-strike beating of her son at home surfaces,,https://reddit.com/r/news/comments/1p26r1p/2nd_grade_teacher_arrested_after_video_of/,4196,414,1763654140.0
reddit,Man indicted on murder charge in Texas shooting of 'King of the Hill' actor Jonathan Joss,,https://reddit.com/r/news/comments/1p26wzg/man_indicted_on_murder_charge_in_texas_shooting/,3128,159,1763654511.0
reddit,Prosecutors move to dismiss charges against Chicago woman shot after ramming car at law enforcement vehicle,,https://reddit.com/r/news/comments/1p28cbc/prosecutors_move_to_dismiss_charges_against/,2545,116,1763657703.0
reddit,"Texas CAIR chapters sue Greg Abbott, Ken Paxton after foreign terrorism designation",,https://reddit.com/r/news/comments/1p2ct85/texas_cair_chapters_sue_greg_abbott_ken_paxton/,1503,39,1763667540.0
reddit,C.D.C. Website No Longer Rejects Possible Link Between Autism and Vaccines (Gift Article),,https://reddit.com/r/news/comments/1p22sxv/cdc_website_no_longer_rejects_possible_link/,3843,233,1763644335.0
reddit,"Bald eagle drops cat through driver’s windshield in Swain County, Highway Patrol confirms",,https://reddit.com/r/news/comments/1p2cn91/bald_eagle_drops_cat_through_drivers_windshield/,928,178,1763667153.0
reddit,Border Patrol is monitoring US drivers and detaining those with 'suspicious' travel patterns,,https://reddit.com/r/news/comments/1p25jb9/border_patrol_is_monitoring_us_drivers_and/,1970,171,1763651287.0
reddit,NTSB releases frame-by-frame images of engine separating during deadly UPS crash in Louisville,,https://reddit.com/r/news/comments/1p2h8t6/ntsb_releases_framebyframe_images_of_engine/,435,67,1763677666.0
reddit,Woman was ‘minding her business’ when man allegedly set her on fire on CTA Train: attorney,,https://reddit.com/r/news/comments/1p26ti5/woman_was_minding_her_business_when_man_allegedly/,1377,218,1763654305.0
reddit,COP30 evacuated after fire breaks out,,https://reddit.com/r/news/comments/1p29u6c/cop30_evacuated_after_fire_breaks_out/,936,79,1763661064.0
reddit,"Labor Department won't release full October jobs report, a casualty of the 43-day federal shutdown",,https://reddit.com/r/news/comments/1p1va7m/labor_department_wont_release_full_october_jobs/,8484,248,1763617386.0
reddit,‘Not going back to prison:’ Elyria man sentenced to 39+ years for breaking deputy’s ribs in courtroom brawl,,https://reddit.com/r/news/comments/1p2bsbv/not_going_back_to_prison_elyria_man_sentenced_to/,613,100,1763665233.0
reddit,Trump signs bill to release the DOJ's Epstein files,,https://reddit.com/r/news/comments/1p1q5ou/trump_signs_bill_to_release_the_dojs_epstein_files/,31827,4283,1763602098.0
reddit,North Korean operatives running fake job portal targeting US AI firms | CNN Politics,,https://reddit.com/r/news/comments/1p2jy4k/north_korean_operatives_running_fake_job_portal/,149,4,1763684521.0
reddit,Trump moves to strip protections for endangered and threatened species,,https://reddit.com/r/news/comments/1p23fka/trump_moves_to_strip_protections_for_endangered/,1017,104,1763646028.0
reddit,DeSoto County rodeo postponed due to equine herpes outbreak,,https://reddit.com/r/news/comments/1p2co28/desoto_county_rodeo_postponed_due_to_equine/,246,32,1763667204.0
reddit,Russian refinery blaze seen on video caused by second Ukrainian attack in a week,,https://reddit.com/r/news/comments/1p24oig/russian_refinery_blaze_seen_on_video_caused_by/,494,21,1763649193.0
reddit,Veteran FBI employee sues bureau after being fired over displaying a pride flag,,https://reddit.com/r/news/comments/1p1iyax/veteran_fbi_employee_sues_bureau_after_being/,19552,253,1763584324.0
reddit,Twin Cities ICE employee among 16 arrested in child sex trafficking sting,,https://reddit.com/r/news/comments/1p1bdqa/twin_cities_ice_employee_among_16_arrested_in/,24891,409,1763567733.0
reddit,Police: SC woman charged with attempted murder for trying to terminate pregnancy,,https://reddit.com/r/news/comments/1p1der6/police_sc_woman_charged_with_attempted_murder_for/,10770,1537,1763572200.0
reddit,Larry Summers resigns from OpenAI board following release of Jeffrey Epstein emails,,https://reddit.com/r/news/comments/1p18zqv/larry_summers_resigns_from_openai_board_following/,33117,1064,1763562191.0
reddit,Justice Department says full grand jury in Comey case didn't review copy of final indictment :: WRAL.com,,https://reddit.com/r/news/comments/1p1dppp/justice_department_says_full_grand_jury_in_comey/,8127,137,1763572872.0
reddit,"Ryan Wedding, ex-Olympian-turned drug lord, charged with murdering witness; FBI offers $15 million reward",,https://reddit.com/r/news/comments/1p1pp3r/ryan_wedding_exolympianturned_drug_lord_charged/,1550,164,1763600819.0
reddit,U.S. trade deficit drops 24% in August as Trump’s tariffs reduce imports,,https://reddit.com/r/news/comments/1p1da2n/us_trade_deficit_drops_24_in_august_as_trumps/,5610,447,1763571908.0
reddit,"Transgender TikTok influencer shot and killed in Florida after fight with boyfriend, officials say",,https://reddit.com/r/news/comments/1p1fnzk/transgender_tiktok_influencer_shot_and_killed_in/,3148,372,1763577104.0
reddit,Profit slide at Target hints at meager holiday season for the retailer,,https://reddit.com/r/news/comments/1p194va/profit_slide_at_target_hints_at_meager_holiday/,6649,923,1763562548.0
reddit,Paris court blocks auction of earliest-known calculator,,https://reddit.com/r/news/comments/1p1tipo/paris_court_blocks_auction_of_earliestknown/,392,25,1763611703.0
reddit,Gaza water provider suspends services after Hamas detains staff member,,https://reddit.com/r/news/comments/1p1ow4r/gaza_water_provider_suspends_services_after_hamas/,757,83,1763598647.0
reddit,Appeals court upholds sex trafficking conviction against ex-GOP operative Lazzaro,,https://reddit.com/r/news/comments/1p1nwtv/appeals_court_upholds_sex_trafficking_conviction/,844,16,1763596113.0
reddit,4 dead after wooden boat believed to be ferrying migrants into the US capsizes off San Diego,,https://reddit.com/r/news/comments/1p1qz4z/4_dead_after_wooden_boat_believed_to_be_ferrying/,493,40,1763604396.0
reddit,"Sarah Ferguson's new book withdrawn from sale, says Nielsen",,https://reddit.com/r/news/comments/1p1cq0n/sarah_fergusons_new_book_withdrawn_from_sale_says/,2416,129,1763570694.0
reddit,‘Mind-blowing’ population of feral goldfish in Ottawa pond to be euthanized,,https://reddit.com/r/news/comments/1p1iwcy/mindblowing_population_of_feral_goldfish_in/,1115,216,1763584204.0
reddit,Singer D4vd considered suspect in investigation of teen found dead in his Tesla: Sources,,https://reddit.com/r/news/comments/1p0uv0v/singer_d4vd_considered_suspect_in_investigation/,22067,1233,1763517333.0
reddit,Russian attack hits flats in one of deadliest strikes on western Ukraine,,https://reddit.com/r/news/comments/1p157nz/russian_attack_hits_flats_in_one_of_deadliest/,1507,82,1763551771.0
reddit,"Pardoned Capitol rioter tried to bribe child sex victim with promise of Jan. 6 payout, officials say",,https://reddit.com/r/news/comments/1p0w9j0/pardoned_capitol_rioter_tried_to_bribe_child_sex/,6624,177,1763521303.0
reddit,"Indonesia's Mount Semeru erupts, blanketing villages with ash and prompting evacuations",,https://reddit.com/r/news/comments/1p1g8np/indonesias_mount_semeru_erupts_blanketing/,231,2,1763578300.0
reddit,Federal judges block Texas from using its new US House map in the 2026 midterms,,https://reddit.com/r/news/comments/1p0jltc/federal_judges_block_texas_from_using_its_new_us/,21523,405,1763490204.0
reddit,"Nearly 21,000 Charlotte-Mecklenburg students absent from school on Monday, officials say",,https://reddit.com/r/news/comments/1p0gsgh/nearly_21000_charlottemecklenburg_students_absent/,25221,2773,1763484031.0
reddit,New Jersey man pardoned of fraud conviction by Trump back in prison for another fraud conviction,,https://reddit.com/r/news/comments/1p0ma6c/new_jersey_man_pardoned_of_fraud_conviction_by/,7731,114,1763496190.0
reddit,Woman set on fire on Chicago transit train after man pours fluid on her and ignites it,,https://reddit.com/r/news/comments/1p0hduc/woman_set_on_fire_on_chicago_transit_train_after/,12905,1133,1763485339.0
reddit,"Trump Administration Removes Report on Missing and Murdered Native Americans, Calling It DEI Content",,https://reddit.com/r/news/comments/1p0fwj7/trump_administration_removes_report_on_missing/,14981,376,1763482059.0
reddit,Romania scrambles fighter jets after drone breach during Russian strike on Ukraine,,https://reddit.com/r/news/comments/1p11no6/romania_scrambles_fighter_jets_after_drone_breach/,516,15,1763539174.0
reddit,Not the real Slim Shady: Eminem sues Australian beach brand Swim Shady over name,,https://reddit.com/r/news/comments/1p0qbnj/not_the_real_slim_shady_eminem_sues_australian/,2831,211,1763505480.0
reddit,Japanese seafood caught up in escalating diplomatic dispute with China,,https://reddit.com/r/news/comments/1p159f2/japanese_seafood_caught_up_in_escalating/,256,46,1763551935.0
reddit,Judge in Comey case blocks order mandating DOJ hand over grand jury evidence,,https://reddit.com/r/news/comments/1p0i7of/judge_in_comey_case_blocks_order_mandating_doj/,5684,121,1763487163.0
reddit,"US charges ex-investment banker, 7 others in global insider trading scheme",,https://reddit.com/r/news/comments/1p0p7le/us_charges_exinvestment_banker_7_others_in_global/,2336,117,1763502893.0
reddit,Florida man accused of stabbing woman to death outside Dollar General is a convicted sex offender,,https://reddit.com/r/news/comments/1p0sycp/florida_man_accused_of_stabbing_woman_to_death/,1135,71,1763512144.0
reddit,"A misplaced wire label caused a power outage on a massive container ship, sending it crashing into a bridge, the NTSB finds",,https://reddit.com/r/news/comments/1p0ivb5/a_misplaced_wire_label_caused_a_power_outage_on_a/,3885,239,1763488589.0
reddit,X and Cloudflare down for thousands of users,,https://reddit.com/r/news/comments/1p0c0e1/x_and_cloudflare_down_for_thousands_of_users/,6983,500,1763472720.0
reddit,"No firm is immune if AI bubble bursts, Google CEO tells BBC",,https://reddit.com/r/news/comments/1p0cwhd/no_firm_is_immune_if_ai_bubble_bursts_google_ceo/,4257,728,1763474960.0
reddit,"Explosion on rail line 'initiated by Russian secret services', Polish government says",,https://reddit.com/r/news/comments/1p0fuh3/explosion_on_rail_line_initiated_by_russian/,2381,93,1763481934.0
reddit,A Chinese firm bought an insurer for CIA agents - part of Beijing's trillion dollar spending spree,,https://reddit.com/r/news/comments/1p0at6x/a_chinese_firm_bought_an_insurer_for_cia_agents/,4293,233,1763469449.0
reddit,"Ukraine hits targets in Russia with US-supplied ATACMS missiles, military says",,https://reddit.com/r/news/comments/1p0l1ie/ukraine_hits_targets_in_russia_with_ussupplied/,1120,46,1763493380.0
reddit,L.A. County Sheriff's Department investigating sex battery claim against Sean 'Diddy' Combs,,https://reddit.com/r/news/comments/1p0h4dm/la_county_sheriffs_department_investigating_sex/,1108,26,1763484773.0
reddit,"Meta prevails in historic FTC antitrust case, won't have to break off WhatsApp, Instagram",,https://reddit.com/r/news/comments/1p0kqeo/meta_prevails_in_historic_ftc_antitrust_case_wont/,490,84,1763492689.0
reddit,"Immigration arrests in Charlotte have sparked fears, leading businesses to close",,https://reddit.com/r/news/comments/1p0115v/immigration_arrests_in_charlotte_have_sparked/,4003,183,1763435543.0
reddit,Florida officials say 122 children were rescued from 'child predators',,https://reddit.com/r/news/comments/1ozusg8/florida_officials_say_122_children_were_rescued/,11051,747,1763419122.0
reddit,Supreme Court Turns Down Pregame Prayer Case,,https://reddit.com/r/news/comments/1ozltqm/supreme_court_turns_down_pregame_prayer_case/,16873,753,1763399171.0
reddit,Judge scolds Justice Department for 'profound investigative missteps' in Comey case,,https://reddit.com/r/news/comments/1ozluqc/judge_scolds_justice_department_for_profound/,14657,275,1763399231.0
reddit,FEMA chief steps down as Trump administration prepared to oust him,,https://reddit.com/r/news/comments/1ozpvnq/fema_chief_steps_down_as_trump_administration/,7266,199,1763408004.0
reddit,TSA investigating how a meat cleaver made it onto a plane in Portland,,https://reddit.com/r/news/comments/1ozwnr2/tsa_investigating_how_a_meat_cleaver_made_it_onto/,2580,431,1763423763.0
reddit,Gunmen abduct 25 girls from a high school in Nigeria and kill one of the staff,,https://reddit.com/r/news/comments/1ozfysl/gunmen_abduct_25_girls_from_a_high_school_in/,16530,737,1763385296.0
reddit,Standard Medicare Part B monthly premium to jump 9.7% in 2026,,https://reddit.com/r/news/comments/1ozkr31/standard_medicare_part_b_monthly_premium_to_jump/,7070,354,1763396790.0
reddit,New Orleans man who had his murder conviction tossed wins election as city's chief record keeper,,https://reddit.com/r/news/comments/1ozr3sp/new_orleans_man_who_had_his_murder_conviction/,1986,27,1763410725.0
reddit,Australian man Johnson Wen jailed after grabbing Ariana Grande at Wicked: For Good premiere,,https://reddit.com/r/news/comments/1ozl28m/australian_man_johnson_wen_jailed_after_grabbing/,2801,256,1763397470.0
reddit,Appeals court denies full review of contempt case against Trump admin over El Salvador deportations,,https://reddit.com/r/news/comments/1ozz252/appeals_court_denies_full_review_of_contempt_case/,376,10,1763430116.0
reddit,Vatican returns Indigenous cultural items to Canada's Catholic bishops on a 'historic day',,https://reddit.com/r/news/comments/1ozhgek/vatican_returns_indigenous_cultural_items_to/,1165,38,1763389097.0
reddit,Bangladesh's ousted leader Sheikh Hasina sentenced to death,,https://reddit.com/r/news/comments/1ozmxq9/bangladeshs_ousted_leader_sheikh_hasina_sentenced/,587,32,1763401617.0
reddit,"FAA lifts order slashing flights, allowing commercial airlines to resume their regular schedules",,https://reddit.com/r/news/comments/1oz7y5u/faa_lifts_order_slashing_flights_allowing/,2310,43,1763356834.0
reddit,Two US marines implicated in killing family in notorious Iraq war shooting,,https://reddit.com/r/news/comments/1oz2d6n/two_us_marines_implicated_in_killing_family_in/,4785,228,1763340416.0
reddit,Germany cancels auction of Holocaust artifacts after backlash,,https://reddit.com/r/news/comments/1oyukmc/germany_cancels_auction_of_holocaust_artifacts/,5982,355,1763321035.0
reddit,"Japan's Sakurajima volcano erupts, ashfall cancels flights",,https://reddit.com/r/news/comments/1oyzayu/japans_sakurajima_volcano_erupts_ashfall_cancels/,2849,58,1763332360.0
reddit,"US military carried out 21st strike on alleged drug boat, killing 3",,https://reddit.com/r/news/comments/1oyx84c/us_military_carried_out_21st_strike_on_alleged/,2882,560,1763327286.0
reddit,Dirt bike crash in California caught on camera,,https://reddit.com/r/news/comments/1oz4p4y/dirt_bike_crash_in_california_caught_on_camera/,796,173,1763346957.0
reddit,India arrests Kashmir resident over deadly Delhi car blast | News,,https://reddit.com/r/news/comments/1oz7ujl/india_arrests_kashmir_resident_over_deadly_delhi/,170,4,1763356504.0
reddit,An Oklahoma sex offender vanished after allegedly staging his own bloody abduction,,https://reddit.com/r/news/comments/1oywxf9/an_oklahoma_sex_offender_vanished_after_allegedly/,737,25,1763326572.0
reddit,Epstein survivor pushes for release of files in wake of new emails: ‘It will bring us closure’ | Jeffrey Epstein,,https://reddit.com/r/news/comments/1oy789z/epstein_survivor_pushes_for_release_of_files_in/,30307,305,1763252098.0
reddit,Refugees to face 20-year wait to settle permanently under asylum reforms in the UK,,https://reddit.com/r/news/comments/1oyf2rk/refugees_to_face_20year_wait_to_settle/,3426,687,1763276490.0
reddit,Washington resident is infected with a different type of bird flu,,https://reddit.com/r/news/comments/1oyeg4z/washington_resident_is_infected_with_a_different/,3432,171,1763274219.0
reddit,"Dad dead, 5-year-old girl missing after wave pulls them into ocean in Monterey County",,https://reddit.com/r/news/comments/1oybz9b/dad_dead_5yearold_girl_missing_after_wave_pulls/,4585,236,1763265997.0
reddit,"Woman waits 20 hours in ER, learns she had a heart attack and needs surgery",,https://reddit.com/r/news/comments/1oy3bot/woman_waits_20_hours_in_er_learns_she_had_a_heart/,14980,707,1763241805.0
reddit,Officer critically injured in Vance motorcade crash,,https://reddit.com/r/news/comments/1oy7ls2/officer_critically_injured_in_vance_motorcade/,3814,319,1763253107.0
reddit,"A Pennsylvania sheriff struck a deal with ICE. Months later, he was voted out.",,https://reddit.com/r/news/comments/1oxu6tx/a_pennsylvania_sheriff_struck_a_deal_with_ice/,20254,203,1763219775.0
reddit,Caribbean countries to hold slavery reparations talks on UK visit,,https://reddit.com/r/news/comments/1oy9eci/caribbean_countries_to_hold_slavery_reparations/,1665,320,1763258215.0
reddit,"Winning ticket for $980 million jackpot sold in Georgia, Mega Millions says",,https://reddit.com/r/news/comments/1oxy76l/winning_ticket_for_980_million_jackpot_sold_in/,6476,174,1763229333.0
reddit,11-year-old killed on his way to school in road-rage shooting near Las Vegas,,https://reddit.com/r/news/comments/1oxuq5f/11yearold_killed_on_his_way_to_school_in_roadrage/,8887,833,1763221087.0
reddit,Search for missing 5-year-old swept into Pacific Ocean continues as southern California braces for devastating rain,,https://reddit.com/r/news/comments/1oxxrfi/search_for_missing_5yearold_swept_into_pacific/,2665,137,1763228298.0
reddit,Australia: Nine injured after Walcha demolition derby car rams into crowd,,https://reddit.com/r/news/comments/1oycel3/australia_nine_injured_after_walcha_demolition/,251,7,1763267344.0
reddit,Man fatally shot during argument between parents outside of Anchorage sports complex,,https://reddit.com/r/news/comments/1oxvzu6/man_fatally_shot_during_argument_between_parents/,1824,177,1763224115.0
reddit,US army veteran who received Purple Heart deported by ICE to Mexico,,https://reddit.com/r/news/comments/1oxhk36/us_army_veteran_who_received_purple_heart/,48460,1298,1763178245.0
reddit,"Tesla requires suppliers to avoid China-made parts for US cars, WSJ reports",,https://reddit.com/r/news/comments/1oxpq8t/tesla_requires_suppliers_to_avoid_chinamade_parts/,1792,140,1763207247.0
reddit,"Turkey demands more than 2,000 years' jail for popular Istanbul mayor Imamoglu",,https://reddit.com/r/news/comments/1oxo54z/turkey_demands_more_than_2000_years_jail_for/,1085,85,1763201509.0
reddit,1st US human bird flu case in 9 months confirmed with strain only seen in animals before,,https://reddit.com/r/news/comments/1oxet4w/1st_us_human_bird_flu_case_in_9_months_confirmed/,3985,217,1763170285.0
reddit,NBC 5 Exclusive: ISIS terror plot exposed against 2024 Chicago Pride Parade,,https://reddit.com/r/news/comments/1ox6p4q/nbc_5_exclusive_isis_terror_plot_exposed_against/,7963,1250,1763150058.0
reddit,"Jeffrey Epstein and Larry Summers's exchanges depict relationship as confidants, emails reveal",,https://reddit.com/r/news/comments/1ox7q3q/jeffrey_epstein_and_larry_summerss_exchanges/,6454,142,1763152386.0
reddit,"Nine killed, 29 injured in blast at police station in India's Kashmir, sources say",,https://reddit.com/r/news/comments/1oxkyj2/nine_killed_29_injured_in_blast_at_police_station/,711,20,1763189495.0
reddit,People held in ‘decrepit’ California ICE facility sue over ‘inhumane’ conditions,,https://reddit.com/r/news/comments/1owyr6a/people_held_in_decrepit_california_ice_facility/,20598,261,1763132401.0
reddit,"Trump asks Justice Department to probe Epstein ties with Clinton, other Democrats",,https://reddit.com/r/news/comments/1ox0t5m/trump_asks_justice_department_to_probe_epstein/,13044,1213,1763136936.0
reddit,Man charged for wearing military uniform without permission on Remembrance Sunday,,https://reddit.com/r/news/comments/1ox8nen/man_charged_for_wearing_military_uniform_without/,3591,113,1763154597.0
reddit,"New prosecutor chosen in Georgia 2020 election interference case against Trump, others",,https://reddit.com/r/news/comments/1owzp29/new_prosecutor_chosen_in_georgia_2020_election/,7476,144,1763134488.0
reddit,Donald Trump pardons UK billionaire and former Tottenham owner Joe Lewis | Donald Trump,,https://reddit.com/r/news/comments/1owyc5k/donald_trump_pardons_uk_billionaire_and_former/,8347,301,1763131438.0
reddit,Top Ukrainian ministers submit their resignations as the country is rocked by a corruption scandal,,https://reddit.com/r/news/comments/1ox7tnl/top_ukrainian_ministers_submit_their_resignations/,2497,34,1763152624.0
reddit,Several killed after bus crashes into bus stop in Stockholm,,https://reddit.com/r/news/comments/1ox079g/several_killed_after_bus_crashes_into_bus_stop_in/,2936,114,1763135607.0
reddit,Judge says he’ll approve Purdue Pharma’s new $7B opioid settlement with the Sacklers,,https://reddit.com/r/news/comments/1ox6iqs/judge_says_hell_approve_purdue_pharmas_new_7b/,967,93,1763149643.0
reddit,"Last Chance U coach John Beam has died after being shot, police say",,https://reddit.com/r/news/comments/1ox7x6b/last_chance_u_coach_john_beam_has_died_after/,414,25,1763152850.0
reddit,London judge finds global mining company BHP Group liable in Brazil’s worst environmental disaster,,https://reddit.com/r/news/comments/1ox17ao/london_judge_finds_global_mining_company_bhp/,851,17,1763137789.0
reddit,Judge orders release of hundreds arrested in Illinois immigration crackdown,,https://reddit.com/r/news/comments/1owhz7r/judge_orders_release_of_hundreds_arrested_in/,24738,298,1763080261.0
reddit,Top Fannie Mae officials ousted after sounding alarm on sharing confidential housing data,,https://reddit.com/r/news/comments/1owhrez/top_fannie_mae_officials_ousted_after_sounding/,26645,1179,1763079692.0
reddit,Trump's Justice Department sues to block California US House maps,,https://reddit.com/r/news/comments/1owckzg/trumps_justice_department_sues_to_block/,19024,960,1763067021.0
reddit,"Jesse Jackson hospitalized, under observation for a neurodegenerative condition",,https://reddit.com/r/news/comments/1owqrdk/jesse_jackson_hospitalized_under_observation_for/,1446,50,1763107696.0
reddit,Epstein offered reporter photos of 'donald and girls in bikinis in my kitchen': Email,,https://reddit.com/r/news/comments/1owa129/epstein_offered_reporter_photos_of_donald_and/,18334,537,1763061147.0
reddit,Starbucks workers kick off 65-store U.S. strike on company's busy Red Cup Day,,https://reddit.com/r/news/comments/1ow75np/starbucks_workers_kick_off_65store_us_strike_on/,29498,802,1763054810.0
reddit,BBC apologises to Trump over Panorama edit but refuses to pay compensation,,https://reddit.com/r/news/comments/1owcjo9/bbc_apologises_to_trump_over_panorama_edit_but/,4574,496,1763066935.0
reddit,Trump administration designates 4 left-wing European networks as terrorist organizations,,https://reddit.com/r/news/comments/1owck7z/trump_administration_designates_4_leftwing/,4331,236,1763066971.0
reddit,"Pennsylvania Sen. John Fetterman hospitalized after fall but ‘doing well,’ spokesperson says | CNN Politics",,https://reddit.com/r/news/comments/1ow9ivo/pennsylvania_sen_john_fetterman_hospitalized/,6365,942,1763060027.0
reddit,Display about Black soldiers in World War II removed from US military cemetery,,https://reddit.com/r/news/comments/1ow1mj8/display_about_black_soldiers_in_world_war_ii/,12256,461,1763041935.0
reddit,U.S. bishops officially ban gender-affirming care at Catholic hospitals,,https://reddit.com/r/news/comments/1owmknf/us_bishops_officially_ban_genderaffirming_care_at/,625,155,1763093287.0
reddit,Italy probes claim that tourists paid to go to Bosnia to kill besieged civilians,,https://reddit.com/r/news/comments/1owg0tj/italy_probes_claim_that_tourists_paid_to_go_to/,1538,88,1763075192.0
reddit,"Verizon to cut about 15,000 jobs as it restructures, source says",,https://reddit.com/r/news/comments/1ow9h5w/verizon_to_cut_about_15000_jobs_as_it/,2521,253,1763059912.0
reddit,"Juan Ponce Enrile, architect of Philippine martial law era who helped oust Marcos, dies at 101",,https://reddit.com/r/news/comments/1owmwld/juan_ponce_enrile_architect_of_philippine_martial/,410,12,1763094270.0
