source,title,body,url,score,num_comments,timestamp
hackernews,VCMI: An open-source engine for Heroes III,,https://vcmi.eu/,1,0,1765038455
hackernews,Jon Voight's Plan to Save Hollywood,,https://deadline.com/2025/05/jon-voight-hollywood-plan-read-in-full-trump-tariffs-1236387042/,1,0,1765038452
hackernews,Anthropic's philosopher answers your questions [video],,https://www.youtube.com/watch?v=I9aGC6Ui3eE,2,0,1765038281
hackernews,Lithuanian Watchdog Fines Torrent Tracker Users for Pirating Local Blockbuster,,https://torrentfreak.com/lithuanian-watchdog-fines-torrent-tracker-users-for-pirating-local-blockbuster/,1,0,1765038034
hackernews,International Atomic Time,,https://en.wikipedia.org/wiki/International_Atomic_Time,1,0,1765037993
hackernews,Show HN: Paperclip Maximizer Bench,,https://d.erenrich.net/paperclip-bench/index.html,1,0,1765037980
hackernews,Earn $100 Today,,https://smartrobotics.com.ng/earn-100-today/,1,0,1765037948
hackernews,The Global Building Atlas,,https://googlemapsmania.blogspot.com/2025/12/introducing-global-building-atlas.html,1,0,1765037895
hackernews,Interactive 3D Electron Orbital Visualizer – Chemistry Tool,,https://claude.ai/public/artifacts/de0c28f3-7a8e-4409-8fb1-53eabf3379ad,1,1,1765037774
hackernews,'The Chair Company' Is a Show About How Fun It Is to Use the Computer,,https://defector.com/the-chair-company-is-a-show-about-how-fun-it-is-to-use-the-computer,3,0,1765037722
hackernews,Stop Paying for 4 AI Models,,https://riskparody.substack.com/p/stop-paying-for-4-ai-models,2,0,1765037721
hackernews,"AI Energy Score v2: Refreshed Leaderboard, Now with Reasoning",,https://huggingface.co/blog/sasha/ai-energy-score-v2,2,0,1765037585
hackernews,"Say Goodbye to the Billable Hour, Thanks to AI",,https://www.wsj.com/tech/ai/ai-goodbye-to-billable-hours-cba198fe,3,1,1765037452
hackernews,Goodbye to an 11-year-old Issue,,https://cassidoo.co/post/eleven-year-issue/,1,0,1765037397
hackernews,Un.org Is Down,,https://www.un.org/,2,0,1765037318
hackernews,Git History,,https://alchemists.io/articles/git_history,1,0,1765037310
hackernews,This Might Be the Biggest Thing in the Universe That Spins,,https://gizmodo.com/this-might-be-the-biggest-thing-in-the-universe-that-spins-2000695690,1,0,1765037248
hackernews,Probing the existence of a fifth force via neutron star cooling,,https://phys.org/news/2025-12-probing-neutron-star-cooling.html,1,0,1765037179
hackernews,Close-up images show how stars explode in real time,,https://phys.org/news/2025-12-images-stars-real.html,1,0,1765037171
hackernews,How to Build an Embedded ChatGPT App (MCP App),,https://sunpeak.ai/blogs/chatgpt-apps-what-i-wish-i-knew,1,1,1765037164
hackernews,Need laundry folded? Don't ask a robot,,https://knowablemagazine.org/content/article/technology/2025/why-robots-cant-fold-laundry,2,0,1765037162
hackernews,Ask HN: Best place to be a founder outside of the US?,,,1,0,1765037017
hackernews,Comparing a Xbox Prototype recreation to the original at Microsoft [video],,https://www.youtube.com/watch?v=kfaJ7gFdmyM,1,0,1765036988
hackernews,Ask HN: How do you handle private DNS for dev/staging environments?,,,2,0,1765036767
hackernews,The Rise of ChatGPT and the Industrialization of the Post-Meaning World,,https://lithub.com/on-the-rise-of-chatgpt-and-the-industrialization-of-the-post-meaning-world/,1,0,1765036760
hackernews,Unaggregating Cloud Watch Metrics,,https://tomlarkworthy.github.io/lopebooks/notebooks/@tomlarkworthy_unaggregating-cloudwatch-metrics.html,3,0,1765036579
hackernews,China's scientific clout is growing as US influence wanes,,https://www.nature.com/articles/d41586-025-03956-y,3,0,1765036558
hackernews,Heuristics and Anecdotes from Books,,https://lindybook.com/tools/knowledge-base/,1,0,1765036523
hackernews,California agencies eye BurnBot for wildfire prevention,,https://www.therobotreport.com/california-agencies-eye-burnbot-for-wildfire-prevention/,1,0,1765036519
hackernews,I built a tiny RSS generator for my Advent of Code solutions,,https://hamatti.org/posts/i-built-a-tiny-rss-generator-for-my-advent-of-code-solutions/,1,0,1765036503
hackernews,How Tally hit their first $1M ARR with a boring product,,https://www.firstmillion.club/p/tally,1,0,1765036434
hackernews,Skin-Shedding Code (2024),,https://registerspill.thorstenball.com/p/skin-shedding-code,4,1,1765036324
hackernews,"Carrier-grade NAT: The Killer of the ""Homelab""",,https://www.a6n.co.uk/2025/06/cgnat-hidden-killer-of-home-web-server.html,2,0,1765036167
hackernews,"Show HN: Picomon, a minimal TUI monitor for AMD GPUs",,https://github.com/omarkamali/picomon,1,1,1765036128
hackernews,Show HN: ThinkMoon – AI Trading Assistant Using LLMs for Live Crypto Trading,,https://demo.thinkmoon.ai/,1,0,1765036096
hackernews,A small neural system that learns structural rewrite rules from 2 examples,,https://re.heavyweather.io,2,1,1765036063
hackernews,American Technology Revolution Reveals Disturbing Non-Human Influence,,https://politicalsaucer.substack.com/p/the-case-for-invasion-american-technology,4,1,1765036056
hackernews,Landauer's Principle,,https://en.wikipedia.org/wiki/Landauer%27s_principle,1,1,1765036046
hackernews,How to Get Hired in 2025,,https://tonsky.me/blog/hiring-ai/,2,0,1765035994
hackernews,"BA Tools, MCP server for sprint planning, velocity, Moscow prioritization",,https://github.com/cs97jjm3/ba-workflow-tools,1,1,1765035923
hackernews,What's New in Oracle Solaris 11.4 SRU 87,,https://blogs.oracle.com/solaris/whats-new-in-oracle-solaris-11-4-sru-87,2,0,1765035876
hackernews,"US orders H-1B spouses, kids to keep social media public from Dec 15",,https://www.business-standard.com/amp/immigration/us-orders-h-1b-spouses-kids-to-keep-social-media-public-from-dec-15-125120400655_1.html,6,1,1765035829
hackernews,WebDriver BiDi+ – JavaScript translation layer between CDP and BiDi,,https://github.com/GoogleChromeLabs/chromium-bidi,1,0,1765035827
hackernews,Typewriter Pen Plotters,,https://biosrhythm.com/?p=2143,1,0,1765035724
hackernews,Star Wars Returns in February of 2027 in Its Original 1977 Theatrical Release,,https://www.ign.com/articles/star-wars-returns-to-theaters-in-february-of-2027-in-its-original-1977-theatrical-release-form,2,0,1765035512
hackernews,4B If Statements,,https://andreasjhkarlsson.github.io//jekyll/update/2023/12/27/4-billion-if-statements.html,2,0,1765035266
hackernews,Muen – An x86/64 Separation Kernel for High Assurance,,https://muen.codelabs.ch/,1,1,1765035212
hackernews,$100k Robot Dogs That Look Like Billionaires? The Artist Explains,,https://www.wsj.com/arts-culture/fine-art/beeple-robot-dogs-regular-animals-art-basel-nft-84043fb9,1,0,1765035178
hackernews,The Missing Device That Changes AI Forever – The Story of the Memristor [video],,https://www.youtube.com/watch?v=AHZxhdjCBSo,3,0,1765035056
hackernews,The Silent Leak: How One Line of Go Drained Memory Across Goroutines,,https://medium.com/harness-engineering/the-silent-leak-how-one-line-of-go-drained-memory-across-thousands-of-goroutines-f9872f6329d1,2,0,1765034857
hackernews,Treating Documentation as a Product,,https://compositecode.blog/2025/12/03/treating-documentation-as-a-product/,1,0,1765034819
hackernews,Dolt Is as Fast as MySQL on Sysbench,,https://www.dolthub.com/blog/2025-12-04-dolt-is-as-fast-as-mysql/,1,0,1765034798
hackernews,What Is Modal?,,https://modal.cx/blog/what-is-modal/,1,0,1765034792
hackernews,OpenAI has trained its LLM to confess to bad behavior,,https://www.technologyreview.com/2025/12/03/1128740/openai-has-trained-its-llm-to-confess-to-bad-behavior/,1,2,1765034559
hackernews,The Cult of Therapy,,https://www.profgalloway.com/the-cult-of-therapy/,2,0,1765034528
hackernews,A New Governing Ecosystem Is Evolving,,https://www.noemamag.com/a-new-governing-ecosystem-is-evolving/,1,0,1765034521
hackernews,Growing Number of Satellites Will Leave Streaks on Photos from Space Telescopes,,https://e360.yale.edu/digest/satellites-orbiting-telescopes-photos,2,1,1765034514
hackernews,What imitating an iconic robot reveals on vocal imitation in parrots&starlings,,https://www.nature.com/articles/s41598-025-23444-7,1,0,1765034410
hackernews,Carv: Whoop for Skiing,,https://getcarv.com,2,0,1765034409
hackernews,AI Slop Is Ruining Reddit for Everyone,,https://www.wired.com/story/ai-slop-is-ruining-reddit-for-everyone/,6,2,1765034326
hackernews,Robot Dog Billionaires Take Photos and Poop Them Out,,https://petapixel.com/2025/12/05/beeple-robot-dogs-photos-elon-musk-mark-zuckerberg-miami-art-basel/,3,1,1765034217
hackernews,Every class I went to during the first week of fall,,https://mitadmissions.org/blogs/entry/every-class-i-went-to-during-the-first-week-of-fall/,1,0,1765033795
hackernews,Fast Median Filter over arbitrary datatypes,,https://martianlantern.github.io/2025/09/median-filter-over-arbitrary-datatypes/,2,0,1765033689
hackernews,Artificial intelligence research has a slop problem,,https://www.theguardian.com/technology/2025/dec/06/ai-research-papers,1,1,1765033640
hackernews,Another AI slop story: ChatGPT vs. Human,,https://joshua.hu/ai-slop-story-nginx-leaking-dns-chatgpt,3,1,1765033618
hackernews,Show HN: Built an all-in-one feedback board for SaaS apps – Ship features,,,2,2,1765033543
hackernews,What if our ancestors didn't feel pain the way we do,,https://www.theatlantic.com/magazine/2026/01/human-ancestors-emotion-history/684959/,3,0,1765033487
hackernews,Dependent Names with a Little Encouragement,,https://consteval.ca/2025/09/27/dependent-names/,1,0,1765033434
hackernews,HTML as an Accessible Format for Papers,,https://info.arxiv.org/about/accessible_HTML.html,40,17,1765033192
hackernews,AoCO 2025: Division,,https://xania.org/202512/06-dividing-to-conquer,3,0,1765032914
hackernews,Carlo is no longer maintained,,https://github.com/GoogleChromeLabs/carlo,4,1,1765032903
hackernews,"Nemawashi: A Powerful, Forgotten Japanese Innovation and Change Management Tool",,https://www.changebase.app/blog/nemawashi-japanese-change-management-tool,4,0,1765032846
hackernews,A 2kb library that makes WebWorkers enjoyable,,https://github.com/GoogleChromeLabs/comlink,3,0,1765032811
hackernews,"Make images smaller using best-in-class codecs, right in the browser",,https://github.com/GoogleChromeLabs/squoosh,2,0,1765032757
hackernews,Measuring AI impact like it's 1995,,https://www.swarmia.com/blog/measuring-ai-impact-like-1995/,2,0,1765032687
hackernews,Messy Crappy Art for the Win,,https://pammoore.substack.com/p/messy-crappy-art-for-the-win,1,0,1765032592
hackernews,The Traveling Salesperson Problem (Modernized),,https://github.com/norvig/pytudes/blob/main/ipynb/TSP.ipynb,2,0,1765032560
hackernews,"Show HN: Tududi v0.87 – A self-hosted life OS: areas, projects, tasks, notes",,https://tududi.com,1,0,1765032493
hackernews,Drones to Diplomas: How Russia's Largest Private University Is Linked to a $25M,,https://krebsonsecurity.com/2025/12/drones-to-diplomas-how-russias-largest-private-university-is-linked-to-a-25m-essay-mill/,3,0,1765032363
hackernews,Web Performance Advent Calendar 2025 – 17th edition,,https://calendar.perfplanet.com/2025/,2,0,1765032113
hackernews,Kidney Recipient Dies After Transplant from Organ Donor Who Had Rabies,,https://www.nytimes.com/2025/12/06/health/rabies-death-skunk-kidney-transplant.html,15,17,1765032051
hackernews,"Manage risk with drawdown, not hope",,https://pyquantnews.substack.com/p/size-positions-by-drawdown-not-hope,1,0,1765031902
hackernews,Decades-old study on common weed killer retracted,,https://www.cbc.ca/news/health/glyphosate-retraction-9.7004363,14,2,1765031899
hackernews,Ceremonial Bugle,,https://ceremonialbugle.com/,1,0,1765031498
hackernews,Show HN: WebGPU back end for PyTorch sneak peek,,https://github.com/jmaczan/torch-webgpu,4,0,1765031233
hackernews,What would someone like me do with a tiny modular synth? [pdf],,https://www.musicthing.co.uk/collateral/WhatWouldSomeoneLikeMeDoWithATinyModularSynth_book.pdf,2,0,1765031174
hackernews,Kernel Float: Unlocking Mixed-Precision GPU Programming,,https://dl.acm.org/doi/pdf/10.1145/3779120,4,0,1765031167
hackernews,Godfather of AI' Geoffrey Hinton says Google is 'beginning to overtake' OpenAI,,https://www.businessinsider.com/ai-godfather-geoffrey-hinton-google-overtaking-openai-2025-12,4,1,1765031092
hackernews,Resolution Dynamics: Deriving the Fine Structure Constant from Shannon Capacity,,https://zenodo.org/records/17821936,9,6,1765031061
hackernews,Show HN: Seq2Seq ML Learns the Inverse of Manual Multiplication (Gelosia Method),,https://gitlab.com/9o1d/gelosia,1,0,1765030962
hackernews,A Class of Models with the Potential to Represent Fundamental Physics,,https://www.wolframphysics.org/technical-introduction/,2,0,1765030954
hackernews,Iran files charges against organizers after women runners flout hijab law,,https://www.timesofisrael.com/iran-files-charges-against-marathon-organizers-after-women-runners-flout-hijab-law/,7,0,1765030837
hackernews,"Why ""all-in-one"" productivity tools confuse new users",,,15,12,1765030768
hackernews,Check out these YouTube Slides generated by VeedoAI,,https://veedo.ai/yt-slides/s/0VKmpTYVWV4FXBtm4,2,0,1765030766
hackernews,Tiny Core Linux: a 23 MB Linux distro with graphical desktop,,http://www.tinycorelinux.net/,107,52,1765030722
hackernews,"Show HN: WhispaQA, the intent-driven QA tool",,https://whispaai.com,2,0,1765030720
hackernews,Implementing AMD GPU debugger and user mode graphics drivers internals in Linux,,https://thegeeko.me/blog/amd-gpu-debugging/,2,0,1765030632
hackernews,I asked AI researchers and economists about SWE career strategy and AI's future,,https://chrisbarber.co/I+asked+AI+researchers+%26+economists+about+SWE+career+strategy+and+the+future+of+AI,3,1,1765030266
hackernews,I Recently Upgraded the Travel Avatar Feature,,https://smartavatar.net/travel-avatar,1,1,1765030191
hackernews,Meta acquires AI device startup Limitless,,https://techcrunch.com/2025/12/05/meta-acquires-ai-device-startup-limitless/,3,1,1765030153
hackernews,C3 vs. Zig in 2025: Who's Fixing C? [video],,https://www.youtube.com/watch?v=y3tDZACGRAY,1,0,1765030103
hackernews,Super-Flat ASTs,,https://jhwlr.io/super-flat-ast/,1,0,1765029982
hackernews,Kiss vs. DRY in Infrastructure as Code: Why Simple Often Beats Clever,,https://rosesecurity.dev/2025/11/14/kiss-versus-dry-iac.html,4,1,1765029964
hackernews,A lost idea can be a lost universe,,https://rishi.monster/posts/a-lost-idea-can-be-a-lost-universe/,2,0,1765029953
hackernews,Things You Shouldn't Leave in the Shed This Winter,,https://www.countryliving.com/gardening/garden-ideas/a69611445/things-to-not-put-garden-shed-winter/,2,0,1765029924
hackernews,Show HN: Octopii – a distributed runtime written in Rust,,https://github.com/octopii-rs/octopii,3,0,1765029878
hackernews,Glitches on video calls linked to real-world decisions,,https://www.theregister.com/2025/12/04/glitchy_video_calls_research/,2,0,1765029877
hackernews,What makes a Platform Team work [audio],,https://www.swarmia.com/podcast/mason-jones-zapier/,1,0,1765029795
hackernews,Show HN: PyTorch-World v0.1.0: Build & Train World Models,,https://github.com/ParamThakkar123/pytorch-world,2,0,1765029791
hackernews,"Memory Crunch Hits PCs: Dell Hikes Prices 20%, Lenovo from January 2026",,https://www.trendforce.com/news/2025/12/05/exclusive-memory-crunch-hits-pcs-dell-hikes-prices-15-20-mid-december-lenovo-from-january-2026/,3,0,1765029738
hackernews,New discovery: The 'sacred boundary' surrounding Stonehenge,,https://www.dw.com/en/new-discovery-the-sacred-boundary-surrounding-stonehenge/a-75039682,2,0,1765029728
hackernews,SDA Church pays fines for 11 inmates at Nsawam Prisons,,https://www.adomonline.com/sda-church-pays-fines-for-11-inmates-at-nsawam-prisons/,1,1,1765029680
hackernews,The Last Year Before AGI and How to Build Software Teams That Survive the Shift,,https://www.tenmas.tech/post/2026-the-last-year-before-agi-and-how-to-build-software-teams-that-survive-the-shift,2,1,1765029658
hackernews,"Show HN: I kept forgetting my supplements while cutting, so I built an app",,https://apps.apple.com/us/app/gymdose-supplement-tracker/id6756020237,1,1,1765029648
hackernews,GrapheneOS is the only Android OS providing full security patches,,https://grapheneos.social/@GrapheneOS/115647408229616018,9,0,1765029511
hackernews,Beeple unleashes uncanny robot canines at Art Basel Miami Beach,,https://www.theartnewspaper.com/2025/12/04/beeple-robot-dogs-elon-musk-art-basel-miami-beach,3,0,1765029389
hackernews,The Forge Roblox Calculator,,https://theforge-calculator.com/,2,0,1765029322
hackernews,How I discovered a hidden microphone on a Chinese NanoKVM,,https://telefoncek.si/2025/02/2025-02-10-hidden-microphone-on-nanokvm/,103,33,1765029299
hackernews,Biological LLM Evo 2: Getting Started,,https://predictbiolabs.com/evo2/,1,0,1765029139
hackernews,When square pixels aren't square,,https://alexwlchan.net/2025/square-pixels/,2,0,1765029102
hackernews,Montaigne's Epistemology,,https://www.jenn.site/montaignes-epistemology/,2,0,1765029095
hackernews,What did you do [video],,https://www.youtube.com/watch?v=bC-8y2R6IxI,1,0,1765029080
hackernews,Because I Wanted To,,https://aaronfrancis.com/2024/because-i-wanted-to-12c5137c,3,1,1765029060
hackernews,Testing Absurd Queues for AI Workloads,,https://leblancfg.com/trying-absurd-postgres-workflows.html,2,0,1765028945
hackernews,A Risk of Cognitive Convenience,,https://davidepstein.substack.com/p/a-risk-of-cognitive-convenience,2,0,1765028902
hackernews,React2Shell (CVE-2025-55182): A Log4Shell Moment for the Front End Ecosystem,,https://securitylabs.datadoghq.com/articles/cve-2025-55182-react2shell-remote-code-execution-react-server-components/,4,1,1765028553
hackernews,"Show HN: KnockKnock – Circular video calls that bring you closer, faster(macOS)",,https://apps.apple.com/ca/app/knockknock/id6740499661?mt=12,1,2,1765028318
hackernews,A Dao of Web Design (2000),,https://alistapart.com/article/dao/,1,0,1765028154
hackernews,A New Best Practice for User Friendly 404 Page Design?,,https://kerrick.blog/posts/2025/a-new-best-practice-for-user-friendly-404-pages/,1,0,1765028136
hackernews,Artificial Womb Technology: Survey of 750 Researchers,,,3,2,1765027970
hackernews,Show HN: FastAPI Matrix Admin – Zero-config secure admin panel with cyberpunk UI,,https://github.com/rasinmuhammed/fastapi-matrix-admin,1,0,1765027908
hackernews,Code Evolution: Self-Improving Software with LLMs and Python,,https://github.com/camilochs/pydaybcn2025-workshop-code-evolution,2,0,1765027873
hackernews,Show HN: I built a JSON-to-PDF book generator because formatting was killing me,,https://ebookforge.app/,2,0,1765027543
hackernews,China's Firefox of the Seas: New Trimaran Semi-Sub,,http://www.hisutton.com/Chinese-Semi-Sub.html,1,0,1765027383
hackernews,Creating the HBO Intro in 1982 by Liberty Studios in NYC,,https://twitter.com/ComputerLove_/status/1997125753289474289,1,0,1765027324
hackernews,"Ask HN: If the US loses, what do you think the world will look like in 15 years?",,,6,11,1765027275
hackernews,Programming Neo6502 in C/C++ Using CC65,,https://retrogamecoders.com/neo6502-cc65/,2,0,1765026787
hackernews,"Is there a finer Latin word than silvicultrix, 'she who dwells in the woods'?",,https://twitter.com/miserabiliter/status/1997052244144046279,1,0,1765026682
hackernews,Show HN: I built SharpSkill because I was frustrated of my Tech interviews,,https://sharpskill.fr/en,2,1,1765026421
hackernews,ARM's Barrel Shifter Tricks,,https://xania.org/202512/05-barrel-shifting-with-arm,3,0,1765026371
hackernews,"Show HN: The Port Augusta Times – ""All the news that's fit to generate""",,https://henrygabriels.github.io/port-augusta-times/index.html,1,0,1765026126
hackernews,Fivehundred reasons to not use Azure,,https://mastodon.social/@azureshit,3,0,1765026085
hackernews,Running TigerBeetle without a control plane database. Part one,,https://aivarsk.com/2025/12/06/tigerbeetle-without-olgp-database1/,2,1,1765026072
hackernews,Show HN: isitworththetime.com – Calculate if automating saves time,,https://isitworththetime.com/,2,0,1765025972
hackernews,Lisp Style & Design (1990) [pdf],,https://archive.org/download/miller-and-benson-1990-lisp-style-design/Miller%20and%20Benson%20-%201990%20-%20LISP%20style%20%26%20design.pdf,3,0,1765025933
hackernews,"""I'll leave you to it""",,https://notoneoffbritishisms.com/2025/12/05/ill-leave-you-to-it/,1,0,1765025754
hackernews,Compiler Design Lectures [video],,https://www.youtube.com/playlist?list=PL3690D679B876DE6A,1,1,1765025589
hackernews,Novel clickjacking attack relies on CSS and SVG,,https://www.theregister.com/2025/12/05/css_svg_clickjacking/,1,0,1765025483
hackernews,Borges on Kalshi,,https://www.mikealche.com/uncategorized/borges-on-kalshi,2,0,1765025343
hackernews,Why Speed Matters,,https://lemire.me/blog/2025/12/05/why-speed-matters/,59,24,1765025202
hackernews,AI chatbots can sway voters better than political advertisements,,https://www.technologyreview.com/2025/12/04/1128824/ai-chatbots-can-sway-voters-better-than-political-advertisements/,3,0,1765025144
hackernews,DNS over TLS with LetsEncrypt,,https://blog.hardill.me.uk/2025/12/06/dns-over-tls-with-letsencrypt/,12,0,1765024689
hackernews,Ask HN: What's Been Your Experience Implementing Web Accessibility?,,,4,4,1765024684
hackernews,Physicists prove the Universe isn't a simulation after all,,https://www.sciencedaily.com/releases/2025/11/251110021052.htm,21,24,1765024666
hackernews,Show HN: Stateless TikToken and Unix-Dictionary GitHub URL Shortener,,https://selfdotsend.com/shorty/,1,0,1765024522
hackernews,Show HN: Trello Clone with Source Code,,https://kanban.demo.codegres.com/,2,0,1765024236
hackernews,Touching the Elephant – TPUs,,https://considerthebulldog.com/tte-tpu/,44,12,1765024168
hackernews,Self-hosted RSS reader with Docker and HTTPS,,https://github.com/ggeorgovassilis/selfhosted-reader,2,1,1765023532
hackernews,John Oliver Auction Raises $1.5M for Public Broadcasting,,https://www.techdirt.com/2025/12/05/john-oliver-auction-raises-1-5-million-for-public-broadcasting/,3,0,1765023473
hackernews,US Flips History by Casting Europe–Not Russia–As Villain in New Security Policy,,https://www.wsj.com/world/europe/u-s-flips-history-by-casting-europenot-russiaas-villain-in-new-security-policy-cbb138fa,9,0,1765023471
hackernews,Desantis Proposal for Citizens Bill of Rights for AI,,https://www.flgov.com/eog/news/press/2025/governor-ron-desantis-announces-proposal-citizen-bill-rights-artificial,2,0,1765023025
hackernews,Why Apple Is Moving Intelligence Back to Your Laptop,,https://www.apple.com/,4,2,1765022974
hackernews,Mapping cell dynamics in hair follicles suggests pull mechanism of hair growth,,https://www.nature.com/articles/s41467-025-65143-x,3,0,1765022960
hackernews,'Life being stressful is not an illness' – GPs on mental health over-diagnosis,,https://www.bbc.com/news/articles/cx2pvxdn9v4o,43,87,1765022813
hackernews,Show HN: GitHub Organisation Years in review stats,,https://github.com/Tazer/years-in-review,4,3,1765022796
hackernews,Why Tehran Is Running Out of Water,,https://www.wired.com/story/why-tehran-is-running-out-of-water-iran-climate-change-drought-extreme-weather/,8,3,1765022724
hackernews,"Iosevka – Versatile typeface for code, from code",,https://github.com/be5invis/Iosevka,4,0,1765022586
hackernews,Replit Design Mode,,https://blog.replit.com/design-mode,3,1,1765022238
hackernews,Claude Opus 4.5 Gave Me a Perfect Tmux Setup,,https://www.hadijaveed.me/2025/12/05/how-claude-opus-gave-me-perfect-tmux-setup/,2,0,1765022116
hackernews,Apple Interface Design Executive Left for Meta,,https://daringfireball.net/2025/12/bad_dye_job,3,0,1765022066
hackernews,llama2.zig: Inference Llama 2 in one file of pure Zig,,https://github.com/cgbur/llama2.zig,4,0,1765022051
hackernews,Cryptids,,https://wiki.bbchallenge.org/wiki/Cryptids,1,0,1765021725
hackernews,Show HN: WDP – A protocol where data migrates to survive seizure,,https://github.com/dododbobovo-commits/wdp,2,0,1765021214
hackernews,We Gave Students Laptops and Took Away Their Brains,,https://www.thefp.com/p/we-gave-students-laptops-and-took,3,0,1765021161
hackernews,Lessons from a Swift Interview,,https://oskargroth.com/blog/swift-interview-lessons,1,0,1765020836
hackernews,Swiss government urges people to ditch Microsoft 365 – lack proper encryption,,https://www.techradar.com/pro/security/swiss-government-urges-people-to-ditch-microsoft-365-and-others-due-to-lack-of-proper-encryption,21,2,1765020694
hackernews,OpenRouter Broadcast,,https://openrouter.ai/docs/guides/features/broadcast/overview,2,0,1765020536
hackernews,Show HN: Holesail – open-source peer-to-peer tunnels,,https://holesail.io/,3,2,1765020501
hackernews,I Pushed an LLM (Claude Opus 4.1) to Its Narrative Limit,,https://medium.com/@gianlucabailo/i-pushed-an-llm-claude-opus-4-1-to-its-narrative-limit-here-is-what-happened-8e14481c1832,1,0,1765020382
hackernews,Show HN: Scanner SEO Internationalization (Free),,https://intlayer.org/i18n-seo-scanner,4,0,1765020129
hackernews,How to spot a startup that can turn into a mafia?,,https://old.reddit.com/r/ycombinator/comments/1pfmtc7/how_to_spot_a_startup_that_can_turn_into_a_mafia/,2,0,1765019984
hackernews,Autism's confusing cousins,,https://www.psychiatrymargins.com/p/autisms-confusing-cousins,100,115,1765019920
hackernews,Octo: A Chip8 IDE,,https://github.com/JohnEarnest/Octo,1,0,1765019878
hackernews,Show HN: Tokenization of Real Estate on Blockchain,,,2,1,1765019705
hackernews,Dynamic Pong Wars,,https://markodenic.tech/dynamic-pong-wars/,4,0,1765019689
hackernews,'Bloodshed supposed to stop': no sign of normal life as Gaza's killing grind on,,https://www.theguardian.com/news/ng-interactive/2025/dec/06/bloodshed-was-supposed-to-stop-no-sign-of-normal-life-as-gazas-killing-and-misery-grind-on,3,0,1765019449
