source,title,body,url,score,num_comments,timestamp
reddit,"Thieves dressed as construction workers steal safe, jewelry valued at $3.2M from New York home",,https://reddit.com/r/news/comments/1ok656l/thieves_dressed_as_construction_workers_steal/,2308,134,1761845615.0
reddit,Hundreds of thousands of ultra-Orthodox Israelis protest against conscription,,https://reddit.com/r/news/comments/1ok0weh/hundreds_of_thousands_of_ultraorthodox_israelis/,3311,284,1761833732.0
reddit,"The Grand Egyptian Museum showcasing 50,000 artifacts is finally opening",,https://reddit.com/r/news/comments/1ok2goz/the_grand_egyptian_museum_showcasing_50000/,1229,91,1761837380.0
reddit,Trump asks Pentagon to immediately start testing US nuclear weapons,,https://reddit.com/r/news/comments/1ojn0ga/trump_asks_pentagon_to_immediately_start_testing/,21644,2414,1761788287.0
reddit,5 more arrests made in Louvre jewel heist,,https://reddit.com/r/news/comments/1oju1jn/5_more_arrests_made_in_louvre_jewel_heist/,2530,163,1761812465.0
reddit,‘This is a big deal’: Health Canada approves 1st drug to slow Alzheimer’s disease,,https://reddit.com/r/news/comments/1ojqi6d/this_is_a_big_deal_health_canada_approves_1st/,4689,100,1761798768.0
reddit,"Italy’s Bending Spoons to acquire AOL, secures $2.8 bln in debt financing",,https://reddit.com/r/news/comments/1ok00ox/italys_bending_spoons_to_acquire_aol_secures_28/,458,63,1761831656.0
reddit,"Paramount Skydance begins layoffs, plans to slash about 2,000 jobs",,https://reddit.com/r/news/comments/1ojlu9q/paramount_skydance_begins_layoffs_plans_to_slash/,4158,200,1761785008.0
reddit,Pentagon orders states’ national guards to form ‘quick reaction forces’ for ‘crowd control’,,https://reddit.com/r/news/comments/1ojaze0/pentagon_orders_states_national_guards_to_form/,20084,1463,1761759240.0
reddit,Broadview ICE protesters including congressional candidate facing federal conspiracy charges,,https://reddit.com/r/news/comments/1ojchz4/broadview_ice_protesters_including_congressional/,12256,261,1761762572.0
reddit,Sean Grayson found guilty of murder in the death of Sonya Massey,,https://reddit.com/r/news/comments/1ojfhi1/sean_grayson_found_guilty_of_murder_in_the_death/,5754,338,1761769313.0
reddit,Trump fires federal arts board in charge of reviewing White House ballroom and ‘Arc de Trump’,,https://reddit.com/r/news/comments/1oj5k66/trump_fires_federal_arts_board_in_charge_of/,25229,1005,1761746997.0
reddit,South Korea awards Trump gold crown amid deal to unlock $350bn trade talks | South Korea,,https://reddit.com/r/news/comments/1oj7g3l/south_korea_awards_trump_gold_crown_amid_deal_to/,6479,849,1761751411.0
reddit,"Man deported to Laos despite US court order blocking his removal, attorneys say | Trump administration",,https://reddit.com/r/news/comments/1ojj2ce/man_deported_to_laos_despite_us_court_order/,1470,45,1761777836.0
reddit,Nigerian Nobel laureate Wole Soyinka says US revoked his visa,,https://reddit.com/r/news/comments/1oj8u2n/nigerian_nobel_laureate_wole_soyinka_says_us/,3671,94,1761754511.0
reddit,Israel strikes Gaza again after overnight bombardment that killed at least 104 | Gaza,,https://reddit.com/r/news/comments/1oj9ped/israel_strikes_gaza_again_after_overnight/,3216,145,1761756452.0
reddit,"US government allowed and even helped US firms sell tech used for surveillance in China, AP finds",,https://reddit.com/r/news/comments/1ojapq1/us_government_allowed_and_even_helped_us_firms/,2088,38,1761758664.0
reddit,Funeral home worker dies after being crushed by concrete burial vault,,https://reddit.com/r/news/comments/1oj21r0/funeral_home_worker_dies_after_being_crushed_by/,4520,255,1761737567.0
reddit,US military withdrawing some troops from Eastern Europe | CNN Politics,,https://reddit.com/r/news/comments/1ojdefh/us_military_withdrawing_some_troops_from_eastern/,1047,106,1761764573.0
reddit,U.S. trade and tariffs loom large over Bank of Canada’s decision to cut rates again,,https://reddit.com/r/news/comments/1oj70k3/us_trade_and_tariffs_loom_large_over_bank_of/,651,8,1761750401.0
reddit,Truck hauling ‘aggressive’ monkeys carrying herpes and COVID overturns in Mississippi,,https://reddit.com/r/news/comments/1oijhb3/truck_hauling_aggressive_monkeys_carrying_herpes/,50488,2312,1761681046.0
reddit,Sudan's military expels top UN food aid officials as conflict escalates,,https://reddit.com/r/news/comments/1oj557l/sudans_military_expels_top_un_food_aid_officials/,410,10,1761746007.0
reddit,Australia denies visa to Dutch Olympian convicted of child rape,,https://reddit.com/r/news/comments/1oifwx2/australia_denies_visa_to_dutch_olympian_convicted/,20721,386,1761672967.0
reddit,Texas AG sues makers of Tylenol over hiding alleged links to autism,,https://reddit.com/r/news/comments/1oi9uxl/texas_ag_sues_makers_of_tylenol_over_hiding/,22154,1773,1761659310.0
reddit,A Federal Agent Shot at a Driver in D.C. An MPD Officer Was Told To Omit the Shooting from His Report,,https://reddit.com/r/news/comments/1oi86ey/a_federal_agent_shot_at_a_driver_in_dc_an_mpd/,12685,180,1761654985.0
reddit,"Prince Andrew hosted Epstein, Maxwell and Weinstein at Royal Lodge",,https://reddit.com/r/news/comments/1oi5h5l/prince_andrew_hosted_epstein_maxwell_and/,27913,550,1761646460.0
reddit,"Texas judges who don’t perform gay weddings for faith reasons won’t face sanctions, high court says",,https://reddit.com/r/news/comments/1oiah9q/texas_judges_who_dont_perform_gay_weddings_for/,5077,476,1761660774.0
reddit,Hurricane Melissa is set to hit Jamaica as its strongest storm since records began,,https://reddit.com/r/news/comments/1oia3kb/hurricane_melissa_is_set_to_hit_jamaica_as_its/,3638,308,1761659886.0
reddit,Chicago's children are getting caught in the chaos of immigration crackdowns,,https://reddit.com/r/news/comments/1oig6iv/chicagos_children_are_getting_caught_in_the_chaos/,1724,113,1761673561.0
reddit,Atlanta journalist says he ‘won’t be the only’ one deported by Trump officials,,https://reddit.com/r/news/comments/1oi9wfi/atlanta_journalist_says_he_wont_be_the_only_one/,2607,65,1761659407.0
reddit,Deputy’s alleged self-inflicted gunshot leads to multiple indictments,,https://reddit.com/r/news/comments/1oi8z6p/deputys_alleged_selfinflicted_gunshot_leads_to/,1785,141,1761657113.0
reddit,Suspect in Charlie Kirk killing can wear street clothes in court amid ‘extraordinary’ attention,,https://reddit.com/r/news/comments/1ohtz5m/suspect_in_charlie_kirk_killing_can_wear_street/,8179,507,1761607493.0
reddit,"Amazon plans to cut 30,000 corporate jobs in response to pandemic overhiring",,https://reddit.com/r/news/comments/1ohoj2a/amazon_plans_to_cut_30000_corporate_jobs_in/,24621,1661,1761594592.0
reddit,India conducts cloud-seeding trial to clear New Delhi’s smog,,https://reddit.com/r/news/comments/1oi91nq/india_conducts_cloudseeding_trial_to_clear_new/,527,94,1761657301.0
reddit,Man accused of killing ex-Japan PM Abe to go on trial Tuesday,,https://reddit.com/r/news/comments/1oi0x7h/man_accused_of_killing_exjapan_pm_abe_to_go_on/,2338,137,1761628064.0
reddit,Congressional Del. Eleanor Holmes Norton of D.C. scammed at home by group claiming to be cleaning crew,,https://reddit.com/r/news/comments/1ohzeif/congressional_del_eleanor_holmes_norton_of_dc/,1757,164,1761622828.0
reddit,"Teen girl stabbed with scissors at school, another teen girl in custody",,https://reddit.com/r/news/comments/1oi5eyo/teen_girl_stabbed_with_scissors_at_school_another/,491,25,1761646245.0
reddit,Queensland’s controversial puberty blocker ban overturned by supreme court,,https://reddit.com/r/news/comments/1ohyehk/queenslands_controversial_puberty_blocker_ban/,1115,84,1761619762.0
reddit,Melissa strengthens to a Category 5 hurricane as it nears Jamaica,,https://reddit.com/r/news/comments/1ohep3f/melissa_strengthens_to_a_category_5_hurricane_as/,10392,635,1761572419.0
reddit,At least 16 killed in bus accident in central Bolivia: police,,https://reddit.com/r/news/comments/1ohxtya/at_least_16_killed_in_bus_accident_in_central/,527,17,1761618097.0
reddit,US Boeing workers continue midwest strike after rejecting latest contract offer,,https://reddit.com/r/news/comments/1ohgyug/us_boeing_workers_continue_midwest_strike_after/,3664,41,1761577760.0
reddit,Lithuania drafting plans to shut Belarus border indefinitely after balloon disruptions,,https://reddit.com/r/news/comments/1ohknv8/lithuania_drafting_plans_to_shut_belarus_border/,2268,17,1761585956.0
reddit,One dead after plane from Canada crashes in Greenland,,https://reddit.com/r/news/comments/1ohm304/one_dead_after_plane_from_canada_crashes_in/,1143,41,1761589073.0
reddit,Trapped and terrified warnings as Sudanese militia advance on Darfur city,,https://reddit.com/r/news/comments/1ohqpwv/trapped_and_terrified_warnings_as_sudanese/,590,58,1761599561.0
reddit,"Cameroon’s Paul Biya, world’s oldest president, re-elected for eighth term",,https://reddit.com/r/news/comments/1ohivpw/cameroons_paul_biya_worlds_oldest_president/,894,108,1761582030.0
reddit,US airports report over 20 air traffic controller shortage triggers in one day | US news,,https://reddit.com/r/news/comments/1oguyfk/us_airports_report_over_20_air_traffic_controller/,33683,1189,1761510296.0
reddit,Trump administration posts notice that no federal food aid will go out Nov. 1,,https://reddit.com/r/news/comments/1ogt27v/trump_administration_posts_notice_that_no_federal/,19331,1305,1761505740.0
reddit,Food benefits set to expire for 41 million people as US shutdown continues,,https://reddit.com/r/news/comments/1ogo3kz/food_benefits_set_to_expire_for_41_million_people/,33066,2955,1761494012.0
reddit,"Super Hornet, Helicopter Assigned to USS Nimitz Crash in South China Sea in Separate Incidents, Crew Safe",,https://reddit.com/r/news/comments/1oh0aee/super_hornet_helicopter_assigned_to_uss_nimitz/,2089,202,1761524164.0
reddit,New Jersey officer stopped at ATM and pizzeria instead of investigating double-murder,,https://reddit.com/r/news/comments/1ogot75/new_jersey_officer_stopped_at_atm_and_pizzeria/,6202,186,1761495716.0
reddit,NCAA ordered to pay $18M to former football player and wife in concussion lawsuit,,https://reddit.com/r/news/comments/1oh1gp3/ncaa_ordered_to_pay_18m_to_former_football_player/,909,54,1761527486.0
reddit,Kurdish rebel group PKK says it is withdrawing its fighters from Türkiye to Iraq,,https://reddit.com/r/news/comments/1ogwza6/kurdish_rebel_group_pkk_says_it_is_withdrawing/,707,96,1761515284.0
reddit,"1 dead, 6 injured in shooting during homecoming at Lincoln University in Pennsylvania, officials say | CNN",,https://reddit.com/r/news/comments/1ogh2nx/1_dead_6_injured_in_shooting_during_homecoming_at/,3539,474,1761473865.0
reddit,"Melissa strengthens into a Category 4 hurricane, threatening catastrophic flooding in Jamaica, Haiti",,https://reddit.com/r/news/comments/1ogmsqz/melissa_strengthens_into_a_category_4_hurricane/,1227,46,1761490865.0
reddit,Two suspects arrested in Louvre museum jewellery heist,,https://reddit.com/r/news/comments/1ogh6pw/two_suspects_arrested_in_louvre_museum_jewellery/,2374,199,1761474286.0
reddit,Judge rules immigration detention of Chicago man with daughter battling cancer is illegal,,https://reddit.com/r/news/comments/1og3g60/judge_rules_immigration_detention_of_chicago_man/,16114,301,1761428384.0
reddit,"13 people shot, 2 dead in Robeson County according to deputies",,https://reddit.com/r/news/comments/1og8ews/13_people_shot_2_dead_in_robeson_county_according/,5635,514,1761442709.0
reddit,Australia Women’s Cricket World Cup players ‘touched inappropriately’ in India,,https://reddit.com/r/news/comments/1og55yz/australia_womens_cricket_world_cup_players/,8547,430,1761433064.0
reddit,Main wreckage of cargo plane recovered from Hong Kong waters after deadly crash,,https://reddit.com/r/news/comments/1ogmurb/main_wreckage_of_cargo_plane_recovered_from_hong/,304,6,1761490999.0
reddit,"June Lockhart, beloved mother figure from ‘Lassie’ and ‘Lost In Space,’ dies at 100",,https://reddit.com/r/news/comments/1og9qco/june_lockhart_beloved_mother_figure_from_lassie/,1347,41,1761446818.0
reddit,"Storm Melissa reaches hurricane strength, threatening catastrophic flooding in northern Caribbean",,https://reddit.com/r/news/comments/1ofyfsf/storm_melissa_reaches_hurricane_strength/,1426,54,1761415868.0
reddit,"At least four people shot near Howard University, Washington DC police say",,https://reddit.com/r/news/comments/1ofmop7/at_least_four_people_shot_near_howard_university/,3702,242,1761382273.0
reddit,"Sex offender freed by mistake spotted ‘in London area’, say police",,https://reddit.com/r/news/comments/1ofnmiv/sex_offender_freed_by_mistake_spotted_in_london/,1821,117,1761385886.0
reddit,"Evidence appears to undercut claims against Letitia James, prosecutors found: Sources",,https://reddit.com/r/news/comments/1ofbdv7/evidence_appears_to_undercut_claims_against/,13200,363,1761344968.0
reddit,Pentagon accepts $130 million donation to help pay the military during the government shutdown,,https://reddit.com/r/news/comments/1ofdj3a/pentagon_accepts_130_million_donation_to_help_pay/,6173,669,1761350997.0
reddit,Alamo Trust CEO resigns after Lt. Gov. Dan Patrick demand,,https://reddit.com/r/news/comments/1ofbtsm/alamo_trust_ceo_resigns_after_lt_gov_dan_patrick/,4445,194,1761346173.0
reddit,"DHS, pressing to deport Kilmar Abrego Garcia, says Liberia has agreed to accept him",,https://reddit.com/r/news/comments/1of3u0l/dhs_pressing_to_deport_kilmar_abrego_garcia_says/,11891,503,1761326695.0
reddit,US student handcuffed after AI system apparently mistook bag of chips for gun,,https://reddit.com/r/news/comments/1oezgid/us_student_handcuffed_after_ai_system_apparently/,12950,438,1761316629.0
reddit,Letitia James pleads not guilty in Virginia mortgage fraud case,,https://reddit.com/r/news/comments/1of1pp0/letitia_james_pleads_not_guilty_in_virginia/,7806,211,1761321800.0
reddit,US is sending an aircraft carrier to Latin America in major escalation of military buildup,,https://reddit.com/r/news/comments/1of3cgm/us_is_sending_an_aircraft_carrier_to_latin/,4881,490,1761325558.0
reddit,"U.S. carried out a strike on another alleged drug-carrying boat in the Caribbean Sea, Pete Hegseth says",,https://reddit.com/r/news/comments/1oeyguf/us_carried_out_a_strike_on_another_alleged/,8947,834,1761314284.0
reddit,Colorado woman found guilty of voter fraud for casting ballots for late ex-husband and son,,https://reddit.com/r/news/comments/1of0t7r/colorado_woman_found_guilty_of_voter_fraud_for/,2548,142,1761319725.0
reddit,Shots fired at vehicle after it backs into US Coast Guard base in the San Francisco Bay Area,,https://reddit.com/r/news/comments/1oeyht5/shots_fired_at_vehicle_after_it_backs_into_us/,1990,221,1761314353.0
reddit,North Korea's Kim says military ties with Russia will 'advance non-stop',,https://reddit.com/r/news/comments/1of1gg9/north_koreas_kim_says_military_ties_with_russia/,1252,76,1761321227.0
reddit,China creates Day of Taiwan’s Restoration as part of sovereignty claims over island,,https://reddit.com/r/news/comments/1oexupi/china_creates_day_of_taiwans_restoration_as_part/,1235,170,1761312729.0
reddit,Alabama executes man with nitrogen gas for 1993 murder over $200 drug debt,,https://reddit.com/r/news/comments/1oemf2s/alabama_executes_man_with_nitrogen_gas_for_1993/,5773,894,1761273558.0
reddit,Family rescued off Cape Cod after sheltering in barn following boat fire | Massachusetts,,https://reddit.com/r/news/comments/1of0wwh/family_rescued_off_cape_cod_after_sheltering_in/,435,36,1761319961.0
reddit,DC man who played Darth Vader theme at national guard troops sues over arrest,,https://reddit.com/r/news/comments/1oeef88/dc_man_who_played_darth_vader_theme_at_national/,19634,532,1761251741.0
reddit,"Donors for Trump’s $300m White House ballroom include Google, Apple and Palantir",,https://reddit.com/r/news/comments/1oe9rqz/donors_for_trumps_300m_white_house_ballroom/,32234,1272,1761241091.0
reddit,Melania Trump’s meme coin architects accused of pump-and-dump fraud in lawsuit,,https://reddit.com/r/news/comments/1oe9tpj/melania_trumps_meme_coin_architects_accused_of/,19718,403,1761241218.0
reddit,ChatGPT-maker OpenAI releases browser in attempt to rival Google,,https://reddit.com/r/news/comments/1ogjysk/chatgptmaker_openai_releases_browser_in_attempt/,0,94,1761483470.0
reddit,Trump pardons Binance founder Changpeng Zhao,,https://reddit.com/r/news/comments/1oe7nph/trump_pardons_binance_founder_changpeng_zhao/,7924,326,1761236313.0
reddit,"Another French museum robbery sees 2,000 gold and silver coins stolen",,https://reddit.com/r/news/comments/1oe6yzj/another_french_museum_robbery_sees_2000_gold_and/,4947,234,1761234780.0
reddit,Toys 'R' Us plans to open new holiday stores in 16 states,,https://reddit.com/r/news/comments/1oe2hyp/toys_r_us_plans_to_open_new_holiday_stores_in_16/,3029,418,1761224059.0
reddit,Federal workers form line down the block for food pantry as shutdown hits third-week mark,,https://reddit.com/r/news/comments/1odxpcb/federal_workers_form_line_down_the_block_for_food/,6514,322,1761207651.0
reddit,Chauncey Billups and Miami Heat's Terry Rozier arrested in federal gambling-related investigation,,https://reddit.com/r/news/comments/1oe2gbw/chauncey_billups_and_miami_heats_terry_rozier/,2274,296,1761223934.0
reddit,"Iceland reports the presence of mosquitoes for the first time, as climate warms",,https://reddit.com/r/news/comments/1odzh10/iceland_reports_the_presence_of_mosquitoes_for/,2596,221,1761214486.0
reddit,"US hits $38 trillion in debt, after the fastest accumulation of $1 trillion outside of the pandemic",,https://reddit.com/r/news/comments/1odo7r7/us_hits_38_trillion_in_debt_after_the_fastest/,65533,2833,1761176479.0
reddit,China imports no US soybeans in September for first time in seven years,,https://reddit.com/r/news/comments/1odp0c1/china_imports_no_us_soybeans_in_september_for/,19990,379,1761178672.0
reddit,Some new ICE recruits have shown up to training without full vetting,,https://reddit.com/r/news/comments/1odng8y/some_new_ice_recruits_have_shown_up_to_training/,8969,473,1761174444.0
reddit,Trump Administration Cuts Cyberdefense Even as Threats Grow,,https://reddit.com/r/news/comments/1odn3ru/trump_administration_cuts_cyberdefense_even_as/,4090,210,1761173538.0
reddit,US military strikes suspected drug vessel in the Pacific,,https://reddit.com/r/news/comments/1odo1gu/us_military_strikes_suspected_drug_vessel_in_the/,2524,395,1761176009.0
reddit,US firearms examiners declared ‘essential’ shutdown workers after gun-lobby pressure | US politics,,https://reddit.com/r/news/comments/1odad20/us_firearms_examiners_declared_essential_shutdown/,13547,608,1761144555.0
reddit,Trump administration moves toward an Arctic Alaska oil lease sale despite the government shutdown,,https://reddit.com/r/news/comments/1odctry/trump_administration_moves_toward_an_arctic/,7034,160,1761149997.0
reddit,Cards Against Humanity and Elon Musk's SpaceX reach settlement over alleged trespassing in Texas,,https://reddit.com/r/news/comments/1odc8g5/cards_against_humanity_and_elon_musks_spacex/,5023,183,1761148697.0
reddit,Reddit sues Perplexity for scraping data to train AI system,,https://reddit.com/r/news/comments/1odjn74/reddit_sues_perplexity_for_scraping_data_to_train/,2109,232,1761165080.0
reddit,"US strikes another alleged drug cartel vessel, expanding attacks to Pacific",,https://reddit.com/r/news/comments/1odgdxi/us_strikes_another_alleged_drug_cartel_vessel/,2476,375,1761157777.0
reddit,Opening statements begin in trial of former Illinois deputy accused of killing Sonya Massey,,https://reddit.com/r/news/comments/1odlk8p/opening_statements_begin_in_trial_of_former/,1067,34,1761169605.0
reddit,White House’s East Wing partially demolished as work begins on Trump’s $250m ballroom,,https://reddit.com/r/news/comments/1od5w7c/white_houses_east_wing_partially_demolished_as/,3205,457,1761133289.0
reddit,Germany to pay local staff at US bases during government shutdown,,https://reddit.com/r/news/comments/1od6hnh/germany_to_pay_local_staff_at_us_bases_during/,950,83,1761135007.0
reddit,Myanmar junta says seized 30 Starlink receivers in scam centre raid,,https://reddit.com/r/news/comments/1od66wa/myanmar_junta_says_seized_30_starlink_receivers/,961,31,1761134175.0
reddit,Authorities in Atlanta say they stopped a mass shooting at one of the world's busiest airports,,https://reddit.com/r/news/comments/1ocppeg/authorities_in_atlanta_say_they_stopped_a_mass/,18130,1727,1761082266.0
reddit,Suspect ‘gravely wounded’ and US marshal injured in Los Angeles immigration enforcement incident,,https://reddit.com/r/news/comments/1oclf3y/suspect_gravely_wounded_and_us_marshal_injured_in/,8418,571,1761072611.0
reddit,American chess grandmaster Daniel Naroditsky dies at 29,,https://reddit.com/r/news/comments/1ocfp2x/american_chess_grandmaster_daniel_naroditsky_dies/,23386,801,1761059763.0
reddit,Warner Bros. Discovery puts itself up for sale,,https://reddit.com/r/news/comments/1ocebd5/warner_bros_discovery_puts_itself_up_for_sale/,5813,745,1761056541.0
reddit,Scholarship for Black students at UC San Diego rebranded after lawsuit argued it was discriminatory,,https://reddit.com/r/news/comments/1ocov3l/scholarship_for_black_students_at_uc_san_diego/,1605,212,1761080320.0
reddit,"CIA playing ‘most important part’ in US strikes in the Caribbean, sources say | CIA",,https://reddit.com/r/news/comments/1ocdftt/cia_playing_most_important_part_in_us_strikes_in/,2959,259,1761054460.0
reddit,Hardliner conservative Sanae Takaichi becomes Japan’s first female leader | CNN,,https://reddit.com/r/news/comments/1oc62oy/hardliner_conservative_sanae_takaichi_becomes/,11795,1629,1761029953.0
reddit,Nicolas Sarkozy enters prison to begin five-year sentence over criminal conspiracy,,https://reddit.com/r/news/comments/1oc8jfa/nicolas_sarkozy_enters_prison_to_begin_fiveyear/,2766,204,1761039686.0
reddit,US appeals court lets Trump send troops to Portland,,https://reddit.com/r/news/comments/1obxjl6/us_appeals_court_lets_trump_send_troops_to/,23512,1626,1761003597.0
reddit,Ontario man faces possible prison time in Ethiopia for having walkie-talkies deemed military equipment,,https://reddit.com/r/news/comments/1ocauee/ontario_man_faces_possible_prison_time_in/,1316,96,1761047549.0
reddit,Artificial intelligence used to make Kingston school threat,,https://reddit.com/r/news/comments/1ocazt6/artificial_intelligence_used_to_make_kingston/,1135,110,1761048016.0
reddit,Woman trying to burn cockroach sets South Korea apartment ablaze,,https://reddit.com/r/news/comments/1oc7gu4/woman_trying_to_burn_cockroach_sets_south_korea/,1340,138,1761035490.0
reddit,"At least 135 mutilated bodies of Palestinians had been held at notorious Israeli jail, say Gaza officials | Gaza",,https://reddit.com/r/news/comments/1obrhay/at_least_135_mutilated_bodies_of_palestinians_had/,15213,712,1760989189.0
reddit,Supreme Court will consider whether people who regularly smoke pot can legally own guns,,https://reddit.com/r/news/comments/1obj9xx/supreme_court_will_consider_whether_people_who/,21134,3616,1760967639.0
reddit,Life-changing eye implant helps blind patients read again,,https://reddit.com/r/news/comments/1oc4mo7/lifechanging_eye_implant_helps_blind_patients/,593,27,1761024625.0
reddit,"Instagram shows more ‘eating disorder adjacent’ content to vulnerable teens, internal Meta research shows",,https://reddit.com/r/news/comments/1obtadr/instagram_shows_more_eating_disorder_adjacent/,2619,102,1760993187.0
reddit,Argentina formalizes $20bn currency swap deal with US | Argentina,,https://reddit.com/r/news/comments/1obn81v/argentina_formalizes_20bn_currency_swap_deal_with/,3775,277,1760978369.0
reddit,Man with gun arrested at Hartsfield-Jackson Atlanta airport after making threats,,https://reddit.com/r/news/comments/1obrn0w/man_with_gun_arrested_at_hartsfieldjackson/,1747,126,1760989536.0
reddit,Amazon Web Services outage hitting platforms around world ‘showing signs of recovery’,,https://reddit.com/r/news/comments/1obh7vx/amazon_web_services_outage_hitting_platforms/,3324,345,1760961864.0
reddit,Indiana University fires student newspaper adviser who refused to block news stories,,https://reddit.com/r/news/comments/1obkfww/indiana_university_fires_student_newspaper/,1865,71,1760970640.0
reddit,"Giuffre thought she might 'die a sex slave' at hands of Epstein and his circle, memoir reveals",,https://reddit.com/r/news/comments/1obcyhc/giuffre_thought_she_might_die_a_sex_slave_at/,8527,133,1760942865.0
reddit,Artillery shell exploded prematurely over California freeway during marines celebration,,https://reddit.com/r/news/comments/1ob6w8s/artillery_shell_exploded_prematurely_over/,21744,1070,1760923240.0
reddit,"Alaska storm damage so bad many evacuees won’t go home for at least 18 months, governor says",,https://reddit.com/r/news/comments/1ob5lmb/alaska_storm_damage_so_bad_many_evacuees_wont_go/,15711,472,1760919475.0
reddit,Baby found alone on Manhattan subway platform near 34th St Garment District,,https://reddit.com/r/news/comments/1obkejb/baby_found_alone_on_manhattan_subway_platform/,795,89,1760970543.0
reddit,U.S. opens investigation into Waymo self-driving cars over safety concerns near school buses,,https://reddit.com/r/news/comments/1objhc9/us_opens_investigation_into_waymo_selfdriving/,794,109,1760968175.0
reddit,Western intelligence agencies eye neo-fascist fight clubs: ‘an international white supremacist movement’,,https://reddit.com/r/news/comments/1obbn9y/western_intelligence_agencies_eye_neofascist/,2509,124,1760937941.0
reddit,Israel says the transfer of humanitarian aid into Gaza is halted 'until further notice',,https://reddit.com/r/news/comments/1oatwlq/israel_says_the_transfer_of_humanitarian_aid_into/,32291,3115,1760891032.0
