source,title,body,url,score,num_comments,timestamp
hackernews,Collusion between firms increases by ninefold after onset of common leadership,,https://www.nber.org/papers/w33866,3,1,1764984012
hackernews,Omi – MIT open-source your AI pendant can trust,,https://www.omi.me/,1,0,1764983980
hackernews,"Without evidence, RFK Jr.'s vaccine panel tosses hep B vaccine recommendation",,https://arstechnica.com/health/2025/12/without-evidence-rfk-jr-s-vaccine-panel-tosses-heb-b-vaccine-recommendation/,38,8,1764983906
hackernews,When Fact-Checking Meant Something,,https://yalereview.org/article/susan-choi-new-yorker-fact-checking,4,0,1764983892
hackernews,EU Commission fines X €120M under the Digital Services Act,,https://ec.europa.eu/commission/presscorner/detail/en/ip_25_2934,2,1,1764983835
hackernews,"Show HN: A Superscript Generator That Works with Any Text, Symbols Included",,https://superscriptgenerator.net/,1,1,1764983833
hackernews,YouTube caught making AI-edits to videos and adding misleading AI summaries,,https://www.ynetnews.com/tech-and-digital/article/bj1qbwcklg,347,200,1764983748
hackernews,I co-wrote a 1k-page prophetic trilogy with GPT – now free at wordnamefire.com,,https://wordnamefire.com/,1,0,1764983386
hackernews,"Google Must Limit Default Contracts to One Year, Judge Rules",,https://www.bloomberg.com/news/articles/2025-12-05/google-must-limit-default-contracts-to-one-year-judge-rules,4,1,1764983285
hackernews,"Are We over the ""Jaws Effect?""",,https://nautil.us/are-we-finally-over-the-jaws-effect-1253001/,2,0,1764983284
hackernews,Ask HN: Why we dont we have dark mode on Hacker News yet? this is not funny,,,6,15,1764983042
hackernews,Hierarchical Black Hole Cosmology: Why We Might Live Inside a Black Hole,,https://www.researchgate.net/publication/398395677_Hierarchical_Black_Hole_Cosmology_From_Quantum_Torsion_to_the_Limits_of_Nested_Universes,1,1,1764982818
hackernews,Puter.js Now Works with Your Favorite Frameworks,,https://developer.puter.com/blog/use-puter-js-in-web-frameworks/,1,0,1764982771
hackernews,HTML Components (1998),,https://www.w3.org/TR/NOTE-HTMLComponents,3,0,1764982757
hackernews,Advent of Code 2025: The AI Edition – By Peter Norvig,,https://github.com/norvig/pytudes/blob/main/ipynb/Advent-2025-AI.ipynb,26,7,1764982613
hackernews,Does anyone use this commit message etiquette?,,,2,2,1764982557
hackernews,Fizz Buzz in 4 lines of CSS,,https://mastodon.social/@susam/115668571178604230,3,1,1764982472
hackernews,Instantaneous Velocity Is a Trap,,https://www.brethorsting.com/blog/2025/12/instantaneous-velocity-is-a-trap/,3,0,1764982379
hackernews,Limitless (Rewind) is acquired by Meta,,,3,1,1764982378
hackernews,Show HN: Tuned.ws – AI growth strategist for Spotify/Apple Music artists (demo),,https://tuned.ws/demo/,1,0,1764981801
hackernews,From Rockets to Heat Pumps,,https://www.heatpumped.org/p/from-rockets-to-heat-pumps,11,5,1764981702
hackernews,The Fate of Empires and Search for Survival (1978) [pdf],,https://people.uncw.edu/kozloffm/glubb.pdf,1,0,1764981635
hackernews,Surprising emergent behavior of sorting algorithms – Michael Levin [video],,https://www.youtube.com/watch?v=jr1sNYY2t9A,1,0,1764981535
hackernews,Extra Instructions Of The 65XX Series CPU (1996),,http://www.ffd2.com/fridge/docs/6502-NMOS.extra.opcodes,65,12,1764981530
hackernews,"In 1995, a Netscape employee wrote a hack in 10 days that now runs the Internet",,https://arstechnica.com/gadgets/2025/12/in-1995-a-netscape-employee-wrote-a-hack-in-10-days-that-now-runs-the-internet/,8,4,1764981524
hackernews,US spending on new data centers is set to outpace spending on new office space,,https://twitter.com/michael_nielsen/status/1997079657557131635,3,3,1764981136
hackernews,World Map of Emergencies,,https://rsoe-edis.org/eventMap,2,0,1764981116
hackernews,Show HN: Tranzia – Safety-Scored Routes for NYC and London Using Real Crime Data,,https://tranzia.vercel.app,1,0,1764981054
hackernews,Sam Altman’s DRAM Deal,,https://www.mooreslawisdead.com/post/sam-altman-s-dirty-dram-deal,293,223,1764980695
hackernews,Staying ahead of censors in 2025: Fighting censorship in Iran and Russia,,https://blog.torproject.org/staying-ahead-of-censors-2025/,2,0,1764980650
hackernews,"ClipNotebook, a simple notebook that turns links into clear visual playlists",,https://clipnotebook.com/,2,2,1764980544
hackernews,Loss of trust in women leaders concern,,https://www.removepaywall.com/search?url=https://www.bloomberg.com/news/articles/2025-12-05/why-people-still-don-t-fully-trust-women-leaders?srnd=homepage-americas,2,1,1764980541
hackernews,Show HN: AcquireMock – Self-hosted mock payment gateway for testing,,https://github.com/illusiOxd/acquiremock,1,2,1764980509
hackernews,Blazing-Fast Magic Beans [video],,https://www.youtube.com/watch?v=AqKFBEvwqqg,2,0,1764979957
hackernews,DSPL: Replacing Transformer Depth with Coupled Recursive Streams for ARC-AGI,,https://zenodo.org/records/17834542,1,1,1764979843
hackernews,Differential Geometry: Paths on a Sphere,,https://foundational.site/differential-geometry-part-i-the-surface-of-a-sphere/,3,0,1764979740
hackernews,Voice AI to book more SaaS demos that doesn't cost an arm,,https://www.sabato.ai/saas,3,1,1764979659
hackernews,Supra Aeon Story with Agda Proof and Provisional Appendix,,https://github.com/GoodRoyal/SupraAeonAgdaStory-Patent,3,0,1764979260
hackernews,Auto optimization of Claude.md with prompt learning,,https://arize.com/blog/claude-md-best-practices-learned-from-optimizing-claude-code-with-prompt-learning/,2,0,1764979193
hackernews,It appears Meta may be ready to put the metaverse out of its misery,,https://www.cnn.com/2025/12/04/business/meta-metaverse-stock-nightcap,12,9,1764978885
hackernews,Thought Experiment: Measuring the Circumference of the Earth from a Bedroom,,,3,1,1764978729
hackernews,Nvidia CUDA Tile,,https://developer.nvidia.com/cuda/tile,2,0,1764978700
hackernews,Cloudflare says it has fended off 416B AI bot scrape requests in 5 months,,https://www.tomshardware.com/tech-industry/big-tech/cloudflare-says-it-has-fended-off-416-billion-ai-bot-scrape-requests-in-five-months-ceo-warns-of-dramatic-shift-for-internet-business-model,7,2,1764978628
hackernews,Phones might get pricier next year. Thank the AI boom,,https://www.cnn.com/2025/12/05/tech/memory-shortage-phone-computer-prices,5,0,1764978591
hackernews,"SteamOS vs. Windows on dedicated GPUs: It's complicated, but Windows has an edge",,https://arstechnica.com/gadgets/2025/12/steamos-vs-windows-on-dedicated-gpus-its-complicated-but-windows-has-an-edge/,2,0,1764978492
hackernews,The NPU in your phone keeps improving–why isn't that making AI better?,,https://arstechnica.com/gadgets/2025/12/the-npu-in-your-phone-keeps-improving-why-isnt-that-making-ai-better/,3,0,1764978467
hackernews,Nonprofits on HCB,,https://hackclub.com/fiscal-sponsorship/directory/,2,0,1764978295
hackernews,Oldest attestation of Austronesian language: Đông Yên Châu inscription,,https://en.wikipedia.org/wiki/%C4%90%C3%B4ng_Y%C3%AAn_Ch%C3%A2u_inscription,2,0,1764978135
hackernews,Please recommend CRM for small hardware startup,,,2,2,1764978107
hackernews,"The future of advertising and cinema is under threat, decline feels inevitable",,https://thesocialjuice.substack.com/p/the-future-of-advertising-and-cinema,2,0,1764978046
hackernews,Show HN: Tacocopter – My Custom Flight Controller Programmed in Rust,,https://github.com/njfdev/tacocopter,2,0,1764978032
hackernews,Cloudflare Outage: Rust Analysis,,https://www.splinter.com.au/2025/12/05/cloudflare-rust-analysis/,2,1,1764977944
hackernews,LanguageTool browser extension is no longer free,,https://languagetool.org/webextension/premium-announcement,2,1,1764977932
hackernews,Corpus of the Inscriptions of Campā (Champa),,https://isaw.nyu.edu/publications/inscriptions/campa/inscriptions/index.html,2,0,1764977727
hackernews,The best predictors of AI use across studies were aversive personality traits,,https://pubmed.ncbi.nlm.nih.gov/40977447/,5,1,1764977719
hackernews,Sword swallowing and its side effects (2006),,https://www.bmj.com/content/333/7582/1285,3,0,1764977611
hackernews,"Gel (ex EdgeDB) shutting down, team joins Vercel",,https://www.geldata.com/blog/gel-joins-vercel,2,0,1764977434
hackernews,Today is my 40th birthday,,https://johnathannader.com/today-my-40th-birthday/,4,2,1764977282
hackernews,You're probably using the wrong dictionary,,https://jsomers.net/blog/dictionary,2,0,1764977231
hackernews,Show HN: Spotify-style Wrapped for Your Claude/ChatGPT History,,https://aiwrapped.co/,1,2,1764977193
hackernews,"Frank Gehry, the Disrupter, Opened Their Imaginations",,https://www.nytimes.com/2025/12/05/arts/design/frank-gehry-appraisal-disney-hall-bilbao-los-angeles.html,2,2,1764977167
hackernews,Kicking Robots – Humanoids and the Tech­ Industry Hype Machine,,https://harpers.org/archive/2025/12/kicking-robots-james-vincent-humanoids/,1,0,1764977121
hackernews,Champa translations shed light on origins (2012),,https://vietnamnet.vn/en/champa-translations-shed-light-on-origins-E54702.html,2,0,1764976950
hackernews,The days are long but the decades are short (2015),,https://blog.samaltman.com/the-days-are-long-but-the-decades-are-short,4,0,1764976793
hackernews,Google 'Looking into' Gmail Hack Locking Users Out with No Recovery,,https://www.forbes.com/sites/daveywinder/2025/12/05/google-looking-into-gmail-hack-locking-users-out-with-no-recovery/,60,29,1764976736
hackernews,"The ""Agentic AI"" Trade Is Stalling",,https://riskparody.substack.com/p/the-agentic-ai-trade-is-stalling,5,0,1764976711
hackernews,The evidence is in: there is no language instinct,,https://aeon.co/essays/the-evidence-is-in-there-is-no-language-instinct,11,0,1764976265
hackernews,Interactive Resume Using Htmx and TailwindCSS,,https://jmuconto.github.io/resume/,3,1,1764976261
hackernews,The Normalization of Deviance in AI,,https://embracethered.com/blog/posts/2025/the-normalization-of-deviance-in-ai/,5,0,1764976233
hackernews,Particle Dynamics // Physics for Game Dev #1 [video],,https://www.youtube.com/watch?v=123nweKVCWA,1,0,1764975666
hackernews,Limitless Acquired by Meta. Rewind Mac app shutting down,,https://9to5mac.com/2025/12/05/rewind-limitless-meta-acquisition/,16,4,1764975522
hackernews,Elon Musk's X fined €120M by EU for transparency violations,,https://www.ft.com/content/cf1ece65-3544-4267-95b4-61ed5372288c,8,1,1764975517
hackernews,Memory Supercycle: How AI's HBM Hunger Is Squeezing DRAM (and What to Own),,https://medium.com/@Elongated_musk/memory-supercycle-how-ais-hbm-hunger-is-squeezing-dram-and-what-to-own-79c316f89586,2,0,1764975442
hackernews,Rust Language Cheat Sheet,,https://cheats.rs/,4,0,1764975147
hackernews,Capellini Geodesic Extrusion Felting: Constants emerge from dimensional collapse,,https://substack.com/inbox/post/180839248,2,3,1764975074
hackernews,Show HN: Middlerok Turns Your GitHub Codebase into a Complete Analytics System,,https://www.middlerok.com/,1,0,1764975025
hackernews,Chamberlain blocks smart home integrations with its garage door openers – again,,https://www.theverge.com/tech/839294/chamberlain-myq-garage-door-opener-update-blocks-aftermarket-controllers,9,0,1764974988
hackernews,How to Create and Read Flamegraphs,,https://keninkujovic.com/blog/flamegraphs,2,1,1764974951
hackernews,Lord of the Rings Extended Editions returning to theaters with a 4D twist,,https://www.fathomentertainment.com/series/the-lord-of-the-rings-trilogy/,1,0,1764974767
hackernews,Ask HN: Best AI model to generate UGC videos via API,,,1,0,1764974681
hackernews,Show HN: NeuroLint – CLI that fixes React/Next.js issues automatically (NO AI),,,1,0,1764974504
hackernews,This EV might be affordable for the masses but there's no screen inside,,https://ktla.com/news/this-ev-might-actually-be-affordable-for-the-masses/,7,4,1764974305
hackernews,Poetiq shatters ARC-AGI 2 benchmark at half the cost,,https://poetiq.ai/posts/arcagi_verified/,13,0,1764974182
hackernews,Anna's Archive finished releasing all obtained Chinese books,,https://annas-archive.li/blog/finished-chinese-release.html,53,5,1764974182
hackernews,Productivity App for Neurodivergent Individuals,,https://dashzz.com,3,0,1764973774
hackernews,Apptron: Local-First Development Platform,,https://github.com/tractordev/apptron,1,0,1764973559
hackernews,"Live Avatar: Streaming Real-Time Audio-Driven Avatar Generation, Infinite Length",,https://liveavatar.github.io/,1,0,1764973552
hackernews,How can I read the standard output of an already-running process?,,https://devblogs.microsoft.com/oldnewthing/20251204-00/?p=111841,2,0,1764973494
hackernews,Could MrBeast IPO? CEO wants fans to have 'a chance to be owners of the company',,https://techcrunch.com/2025/12/03/could-mrbeast-ipo-his-ceo-wants-fans-to-have-a-chance-to-be-owners-of-the-company/,2,1,1764973304
hackernews,Cancer rates in Australians under 50 are rising at an alarming pace,,https://www.abc.net.au/news/2025-07-07/cancer-diagnosis-rates-under-50s-rising-causes-four-corners/105495620,11,1,1764973267
hackernews,Rant: I Don't Need an Office. Let Me Work Remotely,,https://0xff.nu/remote-work/,9,8,1764973226
hackernews,The Polyglot Neuroscientist Resolving How the Brain Parses Language,,https://www.quantamagazine.org/the-polyglot-neuroscientist-resolving-how-the-brain-parses-language-20251205/,5,0,1764973155
hackernews,"Final Judgement in United States of America et al., vs. Google LLC [pdf]",,https://storage.courtlistener.com/recap/gov.uscourts.dcd.223205/gov.uscourts.dcd.223205.1462.0.pdf,4,0,1764973111
hackernews,Gmail Same-Tab Switcher: keep account switches in one tab,,https://twitter.com/BourAbdelhadi/status/1997067403381850129,2,1,1764973073
hackernews,AOC: 'World will end in 12 years' if climate change not addressed (2019),,https://thehill.com/policy/energy-environment/426353-ocasio-cortez-the-world-will-end-in-12-years-if-we-dont-address/,5,0,1764973038
hackernews,The (Knife) Sharpener's Credo,,https://www.thesharpist.com/sharpener-s-credo,3,0,1764973035
hackernews,How I keep up with AI-generated PRs,,https://www.raf.xyz/blog/03-how-i-keep-up-with-ai-generated-prs,10,1,1764972920
hackernews,Meta buys AI pendant startup Limitless to expand hardware push,,https://www.ft.com/content/a1a7adab-506e-4623-8f7a-0b7c94c8d6b4,2,1,1764972886
hackernews,OSS Friday Update – The Shape of Ruby I/O to Come,,https://noteflakes.com/articles/2025-12-05-friday-update,3,0,1764972843
hackernews,"Mr. Roberts Goes to Hollywood, Part 2: The Producer",,https://www.filfre.net/2025/12/mr-roberts-goes-to-hollywood-part-2-the-producer/,4,0,1764972755
hackernews,Adenosine on the common path of rapid antidepressant action: The coffee paradox,,https://genomicpress.kglmeridian.com/view/journals/brainmed/aop/article-10.61373-bm025c.0134/article-10.61373-bm025c.0134.xml,180,123,1764972650
hackernews,Trump awarded FIFA peace prize,,https://apnews.com/article/trump-world-cup-fifa-peace-prize-e14f95b8adaa197c869cad407b6ef604,11,7,1764972518
hackernews,KeePassXC Integration with Rclone and Secret Service API,,https://www.lshnk.me/2025/12/02/arch-linux-bulletproof-keepassxc-integration-with-rclone-and-secret-service-api/,4,2,1764972516
hackernews,Show HN: The Doorstep – Voice RPG,,https://qforge.studio/the-doorstep,4,0,1764972488
hackernews,AI Doesn't Kill Expertise – It Kills Mediocrity,,https://medium.com/@jasonkennedysr/ai-doesnt-kill-expertise-it-kills-mediocrity-95c513f5622b,6,3,1764972109
hackernews,Google AI Pro and Ultra subscribers now have higher rate limits for Antigravity,,https://antigravity.google/docs/plans,1,0,1764971854
hackernews,Git worktree management for parallel AI agent workflows,,https://worktrunk.dev/,2,0,1764971840
hackernews,Arc Prize 2025 Results and Analysis: Year of the Refinement Loop,,https://arcprize.org/blog/arc-prize-2025-results-analysis,9,0,1764971610
hackernews,Agent Harnesses Are Just Shells,,https://pavpanchekha.com/blog/agents-are-shells.html,2,0,1764971560
hackernews,Wall Street Races to Cut Its Risk from AI's Borrowing Binge,,https://www.bloomberg.com/news/articles/2025-12-05/wall-street-races-to-cut-its-risk-from-ai-s-borrowing-binge,5,0,1764971510
hackernews,I got Claude and ChatGPT to stop being sycophantic cheerleaders,,https://medium.com/@scott_waddell/how-i-got-claude-and-chatgpt-to-stop-being-sycophantic-cheerleaders-7ab0b06f3111,4,0,1764971276
hackernews,"A Golden Land? Questioning Frontiers, Fantasies, Fulfillment in the Northwest",,https://lithub.com/a-golden-land-questioning-frontiers-fantasies-and-fulfillment-in-the-pacific-northwest/,4,0,1764971196
hackernews,"Show HN: FlowCoder – Flowcharts for ""Programming"" Claude Code and Codex",,https://github.com/px-pride/flowcoder,1,0,1764971095
hackernews,Evaluating TCP BBRv2 on the Dropbox edge network,,https://arxiv.org/abs/2008.07699,2,0,1764970922
hackernews,New 'physics shortcut' lets laptops tackle quantum problems,,https://www.livescience.com/technology/computing/new-physics-shortcut-lets-laptops-tackle-quantum-problems-once-reserved-for-supercomputers-and-ai,4,0,1764970909
hackernews,"Ask HN: ""Freelancer? Seeking freelancer?"" threads gone?",,,4,3,1764970803
hackernews,Show HN: Sloppylint – A linter for AI-generated Python code,,https://github.com/rsionnach/sloppylint,14,3,1764970602
hackernews,Show HN: A new AI driven task management tool,,https://thebraindump.azurewebsites.net,3,0,1764970507
hackernews,Show HN: BinaryStorage – High-performance PHP binary key/value store,,https://github.com/olivier-ls/binary-storage-php,2,0,1764970452
hackernews,Brendan Gregg Leaving Intel,,https://www.brendangregg.com/blog/2025-12-05/leaving-intel.html,8,0,1764970354
hackernews,Frank Gehry has died,,https://www.bbc.co.uk/news/articles/c5y2p22z9gno,180,63,1764970300
hackernews,Mystery triggers earthquake sensors causing false alert (M5.9) in Bay Area,,https://www.sfgate.com/bayarea/article/mysterious-trigger-earthquake-sensors-calif-21225679.php,2,0,1764970276
hackernews,React2Shell free hands-on lab: learn to exploit and detect,,https://tryhackme.com/room/react2shellcve202555182,1,0,1764970208
hackernews,A $20 drug in Europe requires a prescription and $800 in the U.S.,,https://www.statnews.com/2025/10/31/why-miebo-costs-40-times-more-than-its-european-version/,244,242,1764970042
hackernews,Leaving Intel,,https://www.brendangregg.com/blog//2025-12-05/leaving-intel.html,295,163,1764970024
reddit,U.S. ski resorts are bracing for a steep drop in international travel due to politics,,https://reddit.com/r/news/comments/1pflbax/us_ski_resorts_are_bracing_for_a_steep_drop_in/,12790,977,1765013575.0
reddit,DoJ moves to eliminate sexual abuse protections for LGBTQ+ people in prisons,,https://reddit.com/r/news/comments/1pfitro/doj_moves_to_eliminate_sexual_abuse_protections/,5250,411,1765004029.0
reddit,US Supreme Court agrees to hear case challenging birthright citizenship,,https://reddit.com/r/news/comments/1pf3r0o/us_supreme_court_agrees_to_hear_case_challenging/,23382,2984,1764961748.0
reddit,"Releasing Epstein files could jeopardise my appeal, claims Ghislaine Maxwell",,https://reddit.com/r/news/comments/1pez5zg/releasing_epstein_files_could_jeopardise_my/,34111,2345,1764951286.0
reddit,US student who took four chickens after breaking into slaughterhouse sentenced to 90 days in jail,,https://reddit.com/r/news/comments/1pfftoi/us_student_who_took_four_chickens_after_breaking/,1377,299,1764993834.0
reddit,Grand jury transcripts from abandoned Epstein investigation in Florida ordered released,,https://reddit.com/r/news/comments/1pf2w56/grand_jury_transcripts_from_abandoned_epstein/,8060,47,1764959737.0
reddit,Charities praise new law banning puppy smuggling,,https://reddit.com/r/news/comments/1pfnfsi/charities_praise_new_law_banning_puppy_smuggling/,277,33,1765021590.0
reddit,International Atomic Energy Agency (IAEA) warns the protective shield at Chernobyl Nuclear Power Plant is damaged after a drone strike.,,https://reddit.com/r/news/comments/1pfir6i/international_atomic_energy_agency_iaea_warns_the/,538,40,1765003774.0
reddit,Families of people killed in UPS cargo plane crash sue carrier for wrongful death,,https://reddit.com/r/news/comments/1pfczgg/families_of_people_killed_in_ups_cargo_plane/,1368,52,1764985276.0
reddit,"Detainees at ‘Alligator Alcatraz’ facing ‘harrowing human right violations’, new report alleges",,https://reddit.com/r/news/comments/1peyqa7/detainees_at_alligator_alcatraz_facing_harrowing/,7878,187,1764950301.0
reddit,Pipe bomb suspect told FBI he believed 2020 election conspiracy theories,,https://reddit.com/r/news/comments/1peynpy/pipe_bomb_suspect_told_fbi_he_believed_2020/,6956,326,1764950132.0
reddit,Australia says the world will follow social media ban as Meta starts blocking teens,,https://reddit.com/r/news/comments/1pfd811/australia_says_the_world_will_follow_social_media/,903,141,1764985967.0
reddit,AI deepfakes of real doctors spreading health misinformation on social media,,https://reddit.com/r/news/comments/1pf5kpg/ai_deepfakes_of_real_doctors_spreading_health/,2027,192,1764966052.0
reddit,Renowned Toronto-born architect Frank Gehry dead at 96,,https://reddit.com/r/news/comments/1pf6jqh/renowned_torontoborn_architect_frank_gehry_dead/,1628,44,1764968424.0
reddit,Exclusive: Pilots' union blocks Allegiant Air bid to get US residency for foreign hires​,,https://reddit.com/r/news/comments/1pfsr9k/exclusive_pilots_union_blocks_allegiant_air_bid/,58,6,1765037072.0
reddit,"Canada gained 54,000 jobs in November, third consecutive increase",,https://reddit.com/r/news/comments/1peyod4/canada_gained_54000_jobs_in_november_third/,3661,300,1764950177.0
reddit,US raid allegedly killed Syrian undercover agent instead of Islamic State group official,,https://reddit.com/r/news/comments/1pf09i6/us_raid_allegedly_killed_syrian_undercover_agent/,2451,61,1764953766.0
reddit,"State Department to deny visas to fact checkers and others, citing 'censorship'",,https://reddit.com/r/news/comments/1peuxap/state_department_to_deny_visas_to_fact_checkers/,3930,175,1764940950.0
reddit,Railroads will be allowed to reduce inspections and rely more on technology to spot track problems,,https://reddit.com/r/news/comments/1pf7c7c/railroads_will_be_allowed_to_reduce_inspections/,775,161,1764970346.0
reddit,"Germany introduces controversial new military service law, with powers including needs-based conscription",,https://reddit.com/r/news/comments/1pfe8fz/germany_introduces_controversial_new_military/,263,73,1764988963.0
reddit,New York Times sues Perplexity AI for 'illegal' copying of content,,https://reddit.com/r/news/comments/1pf0nm3/new_york_times_sues_perplexity_ai_for_illegal/,1246,50,1764954645.0
reddit,"Exclusive: US sets 2027 deadline for Europe-led NATO defense, officials say",,https://reddit.com/r/news/comments/1peutwi/exclusive_us_sets_2027_deadline_for_europeled/,1554,522,1764940683.0
reddit,"U.S. Department of Energy lab, active in Alaska, drops ‘renewable’ from name",,https://reddit.com/r/news/comments/1peuu0w/us_department_of_energy_lab_active_in_alaska/,1538,46,1764940694.0
reddit,Kansas accountant diverted family funds to fictitious ‘Middle Finger Ranch’,,https://reddit.com/r/news/comments/1pf0v2p/kansas_accountant_diverted_family_funds_to/,621,29,1764955118.0
reddit,US supreme court approves redrawn Texas congressional maps,,https://reddit.com/r/news/comments/1pegpty/us_supreme_court_approves_redrawn_texas/,20527,2553,1764894515.0
reddit,LA Parents say school-issued iPads are causing chaos with their kids,,https://reddit.com/r/news/comments/1pf0ked/la_parents_say_schoolissued_ipads_are_causing/,535,236,1764954434.0
reddit,Grand jury rejects DOJ's attempt to revive fraud case against New York AG Letitia James: Sources,,https://reddit.com/r/news/comments/1peghla/grand_jury_rejects_dojs_attempt_to_revive_fraud/,11412,247,1764893913.0
reddit,Suspect in US Capitol pipe bomb plot to make first appearance in court,,https://reddit.com/r/news/comments/1pf2ajl/suspect_in_us_capitol_pipe_bomb_plot_to_make/,344,29,1764958359.0
reddit,"WATCH: Pocatello officer cited after hitting, running over pedestrian with patrol car - East Idaho News",,https://reddit.com/r/news/comments/1pey6pc/watch_pocatello_officer_cited_after_hitting/,482,24,1764949021.0
reddit,Former doctor charged with sexual assaults against 38 patients in his care,,https://reddit.com/r/news/comments/1pez7kl/former_doctor_charged_with_sexual_assaults/,402,22,1764951384.0
reddit,Grand jury declines to charge Letitia James after first case dismissed,,https://reddit.com/r/news/comments/1pel6n8/grand_jury_declines_to_charge_letitia_james_after/,2815,76,1764907097.0
reddit,Man charged with trespassing at Travis Kelce's house was trying to serve Taylor Swift subpoena,,https://reddit.com/r/news/comments/1pe97pz/man_charged_with_trespassing_at_travis_kelces/,22261,1003,1764876229.0
reddit,"10,000 removal warrants in Canada Border Services Agency inventory have been active for more than a year",,https://reddit.com/r/news/comments/1pf779s/10000_removal_warrants_in_canada_border_services/,98,6,1764970006.0
reddit,Rare PNG conjoined twins en route to Australia as case reaches 'critical' point,,https://reddit.com/r/news/comments/1pf4dvy/rare_png_conjoined_twins_en_route_to_australia_as/,119,15,1764963243.0
reddit,Three French teens drown after car crashes upside down in swimming pool,,https://reddit.com/r/news/comments/1peissy/three_french_teens_drown_after_car_crashes_upside/,2804,218,1764900223.0
reddit,"Michael Jordan set to testify in NASCAR antitrust trial, sources say",,https://reddit.com/r/news/comments/1pekzvi/michael_jordan_set_to_testify_in_nascar_antitrust/,1839,135,1764906523.0
reddit,Detroit's own crime-fighter RoboCop finally stands guard in Motor City,,https://reddit.com/r/news/comments/1pewjcy/detroits_own_crimefighter_robocop_finally_stands/,247,29,1764945049.0
